dates,details,scores,reviews
 3/16/2015 , fitzy |  Age: 35-44 |   On supplement for 1 to 6 months |   ," Condition: Other , Overall rating 4.3 ,Effectiveness,Ease of Use,Satisfaction,Report this post","I have been taking 2 x 50 mg tablets daily for almost 6 months and my anxiety has almost all but disappeared. This coming from somebody who suffered from chronic anxiety is some claim. The process has been extremely gradual with the effects being more noticeable as time has passed. I have experienced no side effects whatsoever. My only moan would be that the tablets are quite expensive but that is a small price to pay metaphorically speaking. I will continue to take these tablets for the foresee,able future."
 3/11/2015 ,  Age: 45-54 |   On supplement for 1 to 6 months |   ," Condition: Migraine headache , Overall rating 5.0 ,Effectiveness,Ease of Use,Satisfaction,Report this post","I have recently been diagnosed with Atypical Migraines. My symptoms are stroke symptoms so I really needed relief fast! The Neurologist initially prescribed Cymbalta but I had a terrible reaction to it. I have been on L-5HTP for 30 days and I have had very successful results, the severity and amount of episodes has dramatically decreased. I am very happy not to have to take prescribed medication for this issue!"
 3/10/2015 , red |  Age: 65-74 |   On supplement for 1 to 6 months |   ," Condition: Other , Overall rating 1.7 ,Effectiveness,Ease of Use,Satisfaction,Report this post","I started taking this medication due to TV adds stating it would help with memory loss.  I don't feel that it has benefitted me and I have taken it for over a month.  I have never had back pain, however, in the last few days I have had tremendous low back pain and the only thing I am doing different is taking the 5HTP 100 mg a day.  I am going to stop taking this medication immediately as a side effect is eosinophilia-myalgia synddrome.  Hopefully, the pain goes away once I stop the 5-HTP.  "
 3/10/2015 , Poppykay |  Age: 25-34 |   On supplement for 1 to 6 months |   ," Condition: Weight loss , Overall rating 4.3 ,Effectiveness,Ease of Use,Satisfaction,Report this post","I started taking 5-htp to boost my mood and for weight loss. I am taking 100mg tablets once in the morning. I have found I'm less hungry throughout the day and snacking less. My appetite has become smaller and therefore I am eating slightly less. I have continued to exercise twice a week and I've lost 2lbs a week. The only side effect I have noticed is that is appears to cause spotting. I stopped taking it for two weeks when my period started and since I have started it again 3 days ago, the spo,tting has returned. I'm on the implant which is a progesterone only contraceptive. The spotting is a nucience but so far the benefits have outweighed the side effects. I will continue to take it for 4 weeks at a time and then take a break."
 3/10/2015 , vividXX |  Age: 19-24 |   On supplement for less than 1 month |   ," Condition: Other , Overall rating 4.3 ,Effectiveness,Ease of Use,Satisfaction,Report this post","I started 5 htp almost three weeks ago. I was going through a severe depressive episode accompanied by anxiety. My mood would swing from sad, to anxious to okay, then back to sad within an hour. I wasn't eating and experiencing sleep maintenance insomnia. At first, I felt no different but after a week my sleep started to get closer back to normal and my appetite returned. After two weeks, my anxiety started to lift and I was having normal thoughts again. I am not completely back to normal at thi,s point, still have an overall down mood and feel that tense knot in my chest but my days went from horribly unbearable to manageable. I will continue using this product with other vitamins with hope that I will be my old self within the next month or so. "
 3/9/2015 , Maggie from Virginia |  Age: 35-44 |   On supplement for 1 to 6 months |   ," Condition: Other , Overall rating 2.7 ,Effectiveness,Ease of Use,Satisfaction,Report this post","I originally reviewed this in February, and stopped treatment (50 mg 1x per day, one month) as it affected my ability to stay asleep.   I am extremely sensitive to any psychoactive medications, so it's not surprising.   Also, my night time panic attacks continued.  I have since switched to using 100 mg Rhodiola Rosea 1x per day in the morning and supplementing with Magnesium citrate, Natural Vitality's powder as recommended from a friend.  I take the magnesium drink in the evening and it works a,s well as melatonin, without the crazy dreams.  I've noticed a calming affect after only one dose!!  My night time panic is definitely subsiding, but still waking up several times during the night.  In addition to eating well  and increasing my exercise regimen, so far, both of these supplements seem a little gentler on my system.  Also, I use Lemon Balm tea as needed for anxiety in the afternoons.  Always start slow and listen to your body - everybody is different."
 2/26/2015 , Webmd.com |  Age: 55-64 |   On supplement for 1 to 6 months |   ," Condition: Other , Overall rating 4.7 ,Effectiveness,Ease of Use,Satisfaction,Report this post",It has really helped me with stress and anxiety. 
 2/20/2015 ,  Age: 35-44 |   On supplement for 6 months to less than 1 year |   ," Condition: Other , Overall rating 2.3 ,Effectiveness,Ease of Use,Satisfaction,Report this post","I really liked the initial results of this product. However, after the first few days, it seems the medicine wears off and you feel numb and somewhat spacey. The greatest complication came with my menstrual cycle. It completely changed it, causing spotting and 2 periods in one month. Stopped using the product, everything went back to normal. Decided to try it again and miraculously the problems started right back up. I just wanted to leave this review in case anyone else experiences such an issu,e."
 2/20/2015 , N Tuckwell |  Age: 35-44 |   On supplement for 1 to 6 months |   ," Condition: Other , Overall rating 5.0 ,Effectiveness,Ease of Use,Satisfaction,Report this post","Incredibly useful for a period of anxiety. I took 50mg once a day for 2 months and it really helped. I also took iron and magnesium supplements in the form of Floradix liquid and ate 2 eggs a day and a handful of nuts where possible.    I've taken 5HTP before for SAD and it only worked for a day or two. I found St John's Wort more useful for that (but don't take it if you are on the contraceptive pill or blood pressure tablets).     WARNING if you are prone to bi-polar or manic phases then very ,carefully watch yourself and get a good friend to keep an eye on you. I did find that I went very ""UP"" after 2 months and so I stopped it, because I wasn't sleeping enough, over-spending, very easily distracted and over-sensitive. However, I was so relieved to not be feeling miserable and wretched that it was worth it, and I stopped taking 5-HTP after 2 months. So do watch yourself."
 2/15/2015 , Ashjeff |    On supplement for less than 1 month |   ," Condition: Other , Overall rating 2.0 ,Effectiveness,Ease of Use,Satisfaction,Report this post",I am searching for help. This was recommended to me and was just curious if anyone has had any success with it! 
 2/13/2015 , Maggie from Virginia |  Age: 35-44 |   On supplement for 1 to 6 months |   ," Condition: Other , Overall rating 4.0 ,Effectiveness,Ease of Use,Satisfaction,Report this post","I've taken both benzos and SSRI's/SNRI's for panic disorder off and on during stressful times for years.  Just recently, I weaned myself off of Pristiq 50 mg because of the usual side effects (fatigue/feeling like a zombie/apathy) after taking it for 3 years.  Of course, within 8 weeks, the panic attacks resurfaced.  After researching natural methods and reading reviews, I tried the 5 htp 50 mg (Natrol). Initially, some nausea and headaches and fatigue, as well as difficulty staying asleep throu,gh the night.  But the results ARE immediate, with NONE of the other horrible side effects I've always experienced with prescription medication.  My body has adjusted, so no fatigue or nauseau - took it with ginger for 2 weeks, now I don't need to.  I've experimented with taking it in the morning or at night, morning works for me.  Because I'm still having some mild panic sometimes during the night, I'm going to gradually increase the dose - taking 50 mg in the morning and 50 mg at night.   If you experience side effects from other meds, I suggest starting at the lowest dose possible - it seems to be working great!   I will NEVER take a prescription med for anxiety again - it's like poison in your body as far as I'm concerned.  (good old big pharma).."
 2/9/2015 , Ashley |  Age: 25-34 |   On supplement for 1 to 6 months |   ," Condition: Other , Overall rating 5.0 ,Effectiveness,Ease of Use,Satisfaction,Report this post","I bought 5 htp on a whim after just reading the package that advertised a ""healthy mood."" They were accurate. I went home and did research before taking it. I was diagnosed with major depressive disorder 16 years ago and I have struggled my entire life trying to combat it. I stopped taking medication all together and improved my diet. I have taken the 5 htp for a month now and I definitely notice the difference. I am able to live for the day and not worry about tomorrow, enabling me to accomplis,h so much more. It helps me feel happy, satisfied and less anxiety. I will cycle it as it seems fairly common that it can only be used for 3 months at a time."
 2/4/2015 , Happy Life |  Age: 45-54 |   On supplement for 1 to 6 months |   ," Condition: Other , Overall rating 5.0 ,Effectiveness,Ease of Use,Satisfaction,Report this post","I feel great.  Very happy and in control of my life.  I have been taking Natrol 200 mg time released before bed.  Also, I take magnesium glycinate and sleepy time tea with a teaspoon of honey.  I believe in the natural approach to solving problems.  I have been taking 5 HTP for five months, I am able to solve problems and concentrate better on my job.  "
 2/4/2015 , RoseGallacher |    On supplement for less than 1 month |   ," Condition: Other , Overall rating 2.0 ,Effectiveness,Ease of Use,Satisfaction,Report this post","was on 20mg of fluoxetine for two years and came of them 2 months ago,now I went on5-HTP nighttime it puts me to sleep for a couple of hour and I usually wake up  at 2 or 3 in the morning wide awake and can't get back to sleep.Help."
 2/4/2015 , knowitall |  Age: 35-44 |   On supplement for 2 to less than 5 years |   ," Condition: Menopausal symptoms , Overall rating 5.0 ,Effectiveness,Ease of Use,Satisfaction,Report this post","Get off the toxic drugs and try this if you want to feel better and be healthy. I have been taking 100 mg of 5HTP for a few years for anxiety/depression. Now I'm taking it for menopause anxiety. My adult son takes it for anxiety as well. It takes away negative thinking and gives a positive outlook & clear thinking. I don't buy my vitamins at Walmart or Walgreens...you have to use good quality, no fillers. Companies like Natures Way, NOW, Country Life are the best ones. If someone had a negative ,review, I believe it's due to very poor quality 5-HTP or a pharmacutical employee looking out for their interests."
 2/4/2015 , knowitall |  Age: 35-44 |   On supplement for 2 to less than 5 years |   ," Condition: Other , Overall rating 5.0 ,Effectiveness,Ease of Use,Satisfaction,Report this post","Get off the toxic drugs and try this if you want to feel better and be healthy. I have been taking 100 mg of 5HTP for a few years for anxiety/depression. Now I'm taking it for menopause anxiety. My adult son takes it for anxiety as well. It takes away negative thinking and gives a positive outlook & clear thinking. I don't buy my vitamins at Walmart or Walgreens...you have to use good quality, no fillers. Companies like Natures Way, NOW, Country Life are the best ones. If someone had a negative ,review, I believe it's due to very poor quality 5-HTP or a pharmacutical employee looking out for their interests.   "
 2/4/2015 , knowitall |  Age: 35-44 |   On supplement for 2 to less than 5 years |   ," Condition: Other , Overall rating 5.0 ,Effectiveness,Ease of Use,Satisfaction,Report this post","I have been taking 100 mg of 5HTP for a few years for anxiety/depression.  My adult son takes it for anxiety as well. It takes away negative thinking and gives a positive outlook & clear thinking. I don't buy my vitamins at Walmart or Walgreens...you have to use good quality, no fillers. Companies like Natures Way, NOW, Country Life are the best ones. If someone had a negative review, I believe it's due to very poor quality 5-HTP or a pharmacutical employee looking out for their interests. "
 2/1/2015 , amc |  Age: 45-54 |   On supplement for 6 months to less than 1 year |   ," Condition: Fibromyalgia , Overall rating 4.7 ,Effectiveness,Ease of Use,Satisfaction,Report this post","I began taking 5-HTP more than six months ago at the recommendation of my primary care physician. I find that the quality of my sleep has improved and my mood has improved. This, in turn, has improved my energy level and helped to reduce the pain I experience. I am very pleased with the benefits I have experienced from using 5-HTP."
 2/1/2015 , MystikRider |  Age: 35-44 |   On supplement for 2 to less than 5 years |   ," Condition: Other , Overall rating 5.0 ,Effectiveness,Ease of Use,Satisfaction,Report this post","I had tried Dr prescribed antidepressants and apart from the fact it didn't help, I didn't like the way it made me feel. My head always felt cloudy and I just didn't feel like myself. I decided to do some research and everything I read about 5HTP sounded exactly what I needed. A couple weeks after taking these, I was finally able to leave my room, not cry at the drop of a hat and function normally again. I felt like me again. I felt good. "
 1/29/2015 , Browneyes |  Age: 35-44 |   On supplement for 1 to 6 months |   ," Condition: Migraine headache , Overall rating 5.0 ,Effectiveness,Ease of Use,Satisfaction,Report this post","5HTP gave me my life back. I have suffered from Migraines most of my life, and have taken every anti depressant, anti seizure, blood pressure etc. medicine and none of them work and experienced horrible side effects. But I just happen to come across this while I was researching something to curve the carb cravings, and I am so blessed to have found this. I take 200mg 2X a day. It has been wonderful,for the first time I can go a whole 2 weeks with out missing work or my religious meetings. Thank ,Jehovah for 5HTP every one should at least try it, but make sure it's safe to take with any other medication you may have first. My life has changed drastically, and it only took 30days.Thank you 5HTP!!!"
 1/16/2015 ,  Age: 55-64 |   On supplement for 1 to less than 2 years |   ," Condition: Other , Overall rating 3.0 ,Effectiveness,Ease of Use,Satisfaction,Report this post","Started taking 5htp for anxiety, natrol extended and felt it worked very well, and easy to take, but after a year had bad liver count.  Dr. Had me go off of it for three months and retest,..liver was better, then test again after about a year, and back to normal, so if you take it be sure to get liver tests, it must affect some people in a negative way. I do not take it now."
 1/15/2015 ,  Age: 25-34 |   On supplement for less than 1 month |   ," Condition: Other , Overall rating 5.0 ,Effectiveness,Ease of Use,Satisfaction,Report this post",I have mild depression and generalized anxiety disorder.  I take xanax for the anxiety as needed but am unable to tolerate prescription anti depressants due to side effects.  I also tried St. John's Wort and it gave me horrible mood swings.    I have only been on this supplement for a week but so far I am VERY happy with it.  I notice a more positive mood and zero side effects.
 1/15/2015 , misfortune |  Age: 35-44 |   On supplement for 1 to 6 months |   ," Condition: Other , Overall rating 3.7 ,Effectiveness,Ease of Use,Satisfaction,Report this post","Pros: -Stable Positive Mood -Easy to Stay calm in Stressful times -Less hurtful against people  Cons: -Being very hurtful and increasing hostile feeling against people, quickly irritiated and become very angry during the withdrawal process.-Increasing Procrastination -Increasing Forgetfulness -Less Concentration and attention level  "
 1/9/2015 , Eva0 |  Age: 25-34 |   On supplement for 1 to 6 months |   ," Condition: Other , Overall rating 4.3 ,Effectiveness,Ease of Use,Satisfaction,Report this post",Works great.. Stopped taking it because it caused digestive distress and stopped my menstration.
 1/7/2015 , malinda |  Age: 65-74 |   On supplement for 6 months to less than 1 year |   ," Condition: Other , Overall rating 4.7 ,Effectiveness,Ease of Use,Satisfaction,Report this post","I have been taking 5-HTP 100 mg once a day for 8 months.  I started taking it in the morning with breakfast, but got lightheaded, jittery symptoms as one other reviewer mentioned, but switched to taking only in the evening with my meal and have had no other side effects. I now sleep more consistently well throughout each night and have much fewer episodes of anxiety and depression."
 1/6/2015 , Aries |  Age: 55-64 |   On supplement for less than 1 month |   ," Condition: Other , Overall rating 5.0 ,Effectiveness,Ease of Use,Satisfaction,Report this post","I use the 50Mg by NATROL. 45 capsules content.  I use them to stay alert and sharp at work when communicating with customers over the phone.  It wears off after 2-3 hrs, therefore I will take 1 with a small bite of food at 8am, another at around 10:15am,  1pm  and around 3:30pm.   I am 60 years old and have worked for the same company for almost 32 yrs.  It keeps my mood positive throughout the day.  I don't use them after work or on the weekends unless I want that extra lift.   I have started u,sing them about 1 month ago and greatly benefit from them while at work.     "
 1/4/2015 , mcs |  Age: 35-44 |   On supplement for 6 months to less than 1 year |   ," Condition: Migraine headache , Overall rating 4.7 ,Effectiveness,Ease of Use,Satisfaction,Report this post","I started this as an alternative to the migraine medication I had   . Been using due to side effects. It took several weeks of building up in my system, but now I take the 200 mg extended release tab once daily.  I feel better and migraines are less frequent and not as severe."
 12/22/2014 , Snowyone |  Age: 55-64 |   On supplement for 1 to less than 2 years |   ," Condition: Other , Overall rating 5.0 ,Effectiveness,Ease of Use,Satisfaction,Report this post","I have had depression since I was in my 20's and I'm 63 now and have probably taken every antidepressant on the market.  I was recently diagnosed with Sjogrens Syndrome...and antidepressants cause dry mouth and also dry eye.  Cymbalta was making me miserable with the dry, painful eye symptoms.  So I got off of it after taking it for years, it was horrible getting off of it.  I read on a dry eye blog that 5-HTP didn't cause dry mouth or dry eyes, so I thought I'd give it a chance.  I started  off, slowly 100mg extended release and worked up to 200 mg extended release.  I feel wonderful, better than I EVER felt on regular anti-depressants.  My eyes got much better although I still have Sjogrens Syndrome.  But my eyes are extremely painful now that I'm off all anti-depressants.  I've read that some people have stomach issues with this, I haven't.  You'll just have to see what's right for your body.  But I've been on this for over a year now and feel better than I ever have.  My husband says I'm more myself.  I've also read that its helped some people with sleep, not me.  I'm bi-polar so I often have sleep issues.  I highly recommend this supplement if you're depressed and don't want the side effects of regular anti-depressants. I take it by Natrol, 200 mg. extended release."
 12/7/2014 , miss123 |  Age: 25-34 |   On supplement for 1 to 6 months |   ," Condition: Other , Overall rating 4.7 ,Effectiveness,Ease of Use,Satisfaction,Report this post","I have had depression since age 11. I am now 27. I went on anti-depressants for a while and felt more suicidal, so I struggled fighting depression without meds. Since taking 5htp, I sleep a lot better and my mood had been lifted. Yes, it's not a miracle pill which will solve my illness, but it has aided me very well. I feel a weight has been lifted and there are days when I actually feel very happy and carefree. "
 11/25/2014 , Zoe |  Age: 35-44 |   On supplement for 2 to less than 5 years |   ," Condition: Other , Overall rating 4.7 ,Effectiveness,Ease of Use,Satisfaction,Report this post","I have been taking 5-HTP with Niacin for years. It helps subtly equalize mood swings brought on by PMS and promotes less anxiety and depression the rest of the month. I can tell a great deal of difference in my mood and behaviors when I miss a day. When missed I am a lot more susceptible to feelings of doubt at work and quicker to anger at home with my spouse. i am currently taking 100 mg 5-HTP with 500 mg Niacin (flush free) once each morning. I sometimes double the dose of 5-HTP during PMS or ,if I anticipate a more stressful situation. To date I have not had any side effects to my knowledge. My blood work consistently comes back from my doctors office on fulness of health.. "
 10/28/2014 ,  Age: 35-44 |   On supplement for 1 to 6 months |   ," Condition: Other , Overall rating 4.7 ,Effectiveness,Ease of Use,Satisfaction,Report this post",Started using 50mg/day and didn't feel any results. After started using 150mg/day and the results were amazing. Started feeling much better and stoped eating sugar due to the anxiety.
 10/3/2014 , shesaid |  Age: 13-18 |   On supplement for 6 months to less than 1 year |   ," Condition: Other , Overall rating 3.0 ,Effectiveness,Ease of Use,Satisfaction,Report this post","This product worked for me in the beginning, and helped with anxiety. Lately though it has caused ear ringing, vomiting, and dizziness as well as feeling out of it. "
 9/25/2014 , teri |  Age: 45-54 |   On supplement for 1 to less than 2 years |   ," Condition: Other , Overall rating 3.7 ,Effectiveness,Ease of Use,Satisfaction,Report this post","5 htp was very effective for insomnia. I really figured that there were no side effects. After about a year of taking it, something very strange happened. My stomach started rumbling and roaring loudly. Often. Especially embarrassing in social situations. It took me awhile to figure this out. I came across a list of side effects, this was included, so I quit taking immediately. The answer!  Several years later, I tried a night supplement again. Tummy rumbles again! Check the label.... 5 htp..."
 9/21/2014 , Petey52 |  Age: 55-64 |   On supplement for less than 1 month |   ," Condition: Weight loss , Overall rating 2.0 ,Effectiveness,Ease of Use,Satisfaction,Report this post","After taking the Fast Dissolve 5-HTP 100mg within minutes I felt nausea and had diarrhea. I have been on Cymbalta for Fibromyalgia for several years. Thought this might help with weight loss.  I can't handle side effects, so I will no longer take it.  "
 9/19/2014 ,  Age: 65-74 |   On supplement for 1 to 6 months |   ," Condition: Other , Overall rating 5.0 ,Effectiveness,Ease of Use,Satisfaction,Report this post","I have recently been introduced to this  supplement, about 4 to 5 weeks ago. I was seeking relief from headache pain. I take the recommended dose of 100 mg. daily. I am  experiencing a difference in the degree of pain. In addition,to the pain relief; I am able to sleep more deeply. I look forward to charting my experiences for the next few weeks. Thank you each for your experiences as well.  Your comments,The suggested length of time for consume  this supplement 90 days or so. I look forward."
 9/12/2014 , Visigoth |  Age: 55-64 |   On supplement for 10 years or more |   ," Condition: Other , Overall rating 5.0 ,Effectiveness,Ease of Use,Satisfaction,Report this post","I've used it for years without any negative effects. The information on this web page about 5-HTP is misinformed, and not based on fact. EMS has NEVER been caused by 5-HTP. All the reported cases were due to ingestion of contaminated tryptophan, not 5-HTP. Even Wikipedia is a better (referenced) unbiased site for reviewing information on 5-HTP. Be well informed. Don't rely on ultra-conservative sites with no scientific references that support the evidence they propound. Shame on you WEB MD. Stop, being driven by pharmaceutical bias and money."
 9/8/2014 , suz219 |  Age: 35-44 |   On supplement for less than 1 month |   ," Condition: Other , Overall rating 1.0 ,Effectiveness,Ease of Use,Satisfaction,Report this post","On paper, this looks to be the perfect supplement for me, but soon after I took it, I felt extremely nauseous.  It was so bad, I almost went home from work.  It made me feel more anxious."
 9/7/2014 , Sis |  Age: 65-74 |   On supplement for less than 1 month |   ," Condition: Other , Overall rating 5.0 ,Effectiveness,Ease of Use,Satisfaction,Report this post",I have insomnia helps a lot to fall asleep and dream.
 8/23/2014 ,  Age: 45-54 |   On supplement for 1 to less than 2 years |   ," Condition: Other , Overall rating 4.7 ,Effectiveness,Ease of Use,Satisfaction,Report this post","Actually, I have a comment.  Your website claims that one of the side-effects is eosiophelia.  This is outdated information that should be corrected.  The cases of eosinophelia that occurred in 1980's were caused by a genetically engineered manufacturing process employed by one company (Showa Denko of Japan) that had flooded the US market with the tainted product.  Please research this topic more thoroughly."
