dates,details,scores,reviews
 1/27/2019 ,  Age: 55-64 |   On supplement for 1 to less than 2 years |   ," Condition: Other , Overall rating 3.7 ,Effectiveness,Ease of Use,Satisfaction,Report this post","Began using 5HTP when I lost my insurance for a while and had to go off of Pristiq. AWFUL drug to stop taking abruptly. I was greatly helped by 5HTP! I really don't think there's anything on the planet that could have removed all of the symptoms of that experience, but this was a lifesaver. I noticed an improvement the 2nd or 3rd day, and have been taking ever since. It's also helpful for anxiety and good sleep. I do find that I need to go off for a few days or so as it seems to lose it's effect,iveness.  A word of caution, try to hang in there if you get stomach issues. They go away after the first week, and the and the quick desolve tablets are easier on the tummy. Also start out with a lower dosage if you do have issues. Great stuff peeps!! "
 1/17/2019 , user |  Age: 45-54 |   On supplement for 2 to less than 5 years |   ," Condition: Other , Overall rating 3.7 ,Effectiveness,Ease of Use,Satisfaction,Report this post",it's important to take 5 htp with a green tea extract supplement to avoid heart valve damage.  please research the combination to learn about it and prevent health issues.
 12/15/2018 ,  Age: 45-54 |   On supplement for less than 1 month |   ," Condition: Other , Overall rating 1.7 ,Effectiveness,Ease of Use,Satisfaction,Report this post",
 10/22/2018 , Ivan |  Age: 45-54 |   On supplement for less than 1 month |   ," Condition: Other , Overall rating 4.0 ,Effectiveness,Ease of Use,Satisfaction,Report this post","(Part 2)   Today is the 4th day of taking 5-HTP. I still feel sad, have negative thoughts and bouts of anger, but they quickly dissipate and no longer linger on to consume me like what they used to. There’s this sense of calmness that is allowing me to make sound judgements and decisions without being hampered by negative feelings all the time. I feel like the decisions that I make will lead to positive results, as opposed to bad endings that I used to feel prior to taking 5–HTP.  Might be too e,arly, but I can safely say that I am no longer a victim of my own depressive thoughts.  I am no longer a person who is constantly sad and angry. The only flip side is that 5-HTP does wreak some havoc in my stomach and I feel bloated with gas at times. But it does seem to feel less intense as the days go and I am hoping that my gut will get used to this supplement.   Overall, what a miracle supplement. My only regret is that why didn't anyone informed me about 5-HTP earlier. I feel as if so many decades of my life wasted on being weary all the time and so many days and opportunities to seek happiness were missed. Nonetheless, better late than never.   "
 7/3/2018 ,  Age: 25-34 |   On supplement for 1 to 6 months |   ," Condition: Other , Overall rating 5.0 ,Effectiveness,Ease of Use,Satisfaction,Report this post",Effectively replaced my SSRI with 5 HTP. I have moderate GAD and social anxiety disorder that I feel is under control with 5 HTP. I take 100 mg once daily in the evening. Works best after using for several weeks.
 6/26/2018 , Nameless Artist with ADD |  Age: 35-44 |   On supplement for 1 to 6 months |   ," Condition: Other , Overall rating 4.7 ,Effectiveness,Ease of Use,Satisfaction,Report this post","I started taking 5-HTP for depression and anxiety. I experienced results within three days of taking 50mg once a day in the AM. It works for me, YMMV. The mood effect is subtle but consistent. My mood feels more stable, particularly more resilient. I have fewer anxiety spikes.    I didn't take it for sleep disturbance, but it has improved the quality of sleep significantly. I wake up much earlier and without grogginess when I've taken it the day before. I also have dreams that I remember. Part o,f the stress resilience I feel may come from the effects the 5-HTP has had on my sleep.    It's probably not a plug-and-play supplement that can safely be taken on its own. Do your research. I take l-tyrosine with it (to prevent dopamine depletion/imbalance). The recommended ratio is 10:1, but my body seems to do better with 5:1. Because 5-HTP can cause heart valve damage via increased peripheral serotonin, I take EGCG (which effectively neutralizes the peripheral serotonin that doesn't make it past the BBB) and omega-3 (to increase bio-availability of the EGCG)."
 6/17/2018 , Debala |  Age: 45-54 |   On supplement for 1 to 6 months |   ," Condition: Menopausal symptoms , Overall rating 5.0 ,Effectiveness,Ease of Use,Satisfaction,Report this post","Taking 200mg tabs, one in the morning and one at night. Makes a huge difference. I feel much better, more lighthearted and playful in addition to feeling healthy. "
 6/2/2018 ,  Age: 25-34 |   On supplement for 1 to 6 months |   ," Condition: Other , Overall rating 5.0 ,Effectiveness,Ease of Use,Satisfaction,Report this post","My grandmother gave me these to try. I was moody throughout the day,tired all the time and I just didn't feel very positive about life. I wasn't getting a restful nights sleep and I could feel my anxiety just eatting at me all day long. I've tried medications from my doctor but they make me feel fuzzy minded and kinda (zombiefied) so I quickly stopped them. After starting 5-HTP within days my mood changed drastically. I took one pill in the morning on a empty stomach and about a hour later I fel,t so much better, positive and happy. When I wake up in the morning I feel like I've had a great night sleep. I have been on HTP for about a month and I can honestly say I am so happy I stated these. I would definitely recommend these to anyone that might be feeling off, sluggish and unhappy."
 5/31/2018 , B |  Age: 35-44 |   On supplement for less than 1 month |   ," Condition: Fibromyalgia , Overall rating 1.0 ,Effectiveness,Ease of Use,Satisfaction,Report this post","Every time I have tried 5 http, I have been nauseous or thrown up. Has anyone else had this problem?  "
 5/22/2018 , Higher burning fire |  Age: 35-44 |   On supplement for 1 to 6 months |   ," Condition: Other , Overall rating 5.0 ,Effectiveness,Ease of Use,Satisfaction,Report this post",I feel like a new person since starting 5htp 2 months ago. Nothing else made me feel this well adjusted and happy. Everyone who knows me can tell the difference. I wish I had found this years ago.
 5/22/2018 ,  Age: 45-54 |   On supplement for less than 1 month |   ," Condition: Other , Overall rating 2.3 ,Effectiveness,Ease of Use,Satisfaction,Report this post","Took for 2 days in a combo herb supplement for sleep from Whole Foods. The 2nd day I had severe numbness and tingling in my feet and up my legs. My arms were becoming numb too. I looked it up on the internet and found that this herb can cause an incurable disease called EMS (Eosinophilia Myalgia Syndrome). People have died from this disease. In 1989 there was an outbreak of it from Tryptophan. Numbness and tingling in the feet is one of the symptoms. I was scared to death. I waited a week to see, if the ""pins and needles"" went away but they didn't, so went to an Urgent Care. They took my blood and urine. After 5 days they told me that my test results were normal but wanted me to get tested again. Now after 3 weeks the pins and needles are going away. I seem more sensitive now to other side effects though. I would never touch this again. L-Tryptophan is the same thing. I think it should be banned."
 3/16/2018 , ssssrrrrraaaa |  Age: 19-24 |   On supplement for less than 1 month |   ," Condition: Other , Overall rating 4.3 ,Effectiveness,Ease of Use,Satisfaction,Report this post","I had been in a relatively light but still very draining depression for the past year or so. I used 5-HTP a few times before but it was never when I was really depressed so all it did was give me a calmer feeling and slight contentment. This week I started using 5-HTP again, with doses averaging 300-500mg a day. By the very first few days I have already noticed an increased mood, and more positive thinking. I had already begun a change in my mentality before the 5-HTP that was pulling me out of ,my depression but the 5-HTP just catapulted me straight upwards and I feel that it is speeding the process. Somedays I just look around me and am in this feeling of wonder and aliveness. It's like that feeling of life has been handed back to me. It's very meditative. I would recommend this BUT I am worried about heart valve issues if used for a long-term time, so I will be weaning off of this slowly now as I believe I have already gained what I wanted from it. Though I do think the heart valve damage is very unlikely with normal use, as one study I read used HEROIC doses on rats for 3 months, no human being is likely to be using such doses so as long as you make this a short treatment, it is wonderful!"
 1/18/2018 ,  Age: 13-18 |   On supplement for less than 1 month |   ," Condition: Other , Overall rating 4.0 ,Effectiveness,Ease of Use,Satisfaction,Report this post","i have been on this for about 4 days and so far has been really good. i am pretty satisfied with this product i have taken 200mg now down to 100mg and planning to take breaks as recommended by everyone. it has definitly been sublte for me but it has improved my mood, sleep and made me more calm and relaxed overall. reccomend for anyone that has some depression or anxiety to give it a shot. everyone reacts differently so see what it does for you. Also i think this is something that works better i,n smaller doses over a longer period of time. Thanks "
 11/5/2017 ,  Age: 65-74 |   On supplement for less than 1 month |   ," Condition: Migraine headache , Overall rating 1.7 ,Effectiveness,Ease of Use,Satisfaction,Report this post",ABSOLUTEL HAD NO EFFECT ON ME
 10/2/2017 , Tonya |  Age: 45-54 |   On supplement for 1 to 6 months |   ," Condition: Other , Overall rating 1.0 ,Effectiveness,Ease of Use,Satisfaction,Report this post","Taking 5-HTP causes extreme nausea, vomiting, and shakiness. "
 9/21/2017 , Kathleen |  Age: 35-44 |   On supplement for 5 to less than 10 years |   ," Condition: Other , Overall rating 5.0 ,Effectiveness,Ease of Use,Satisfaction,Report this post","I have been taking this supplement for years now. It has helped me with long term anxiety and depression, even hormonal anxiety before menstruation. My symptoms returned after not taking it for a few weeks, then when I started taking the supplement again, my life went back to normal and I felt safe and happy again. I would recommend this supplement to anyone not wanting to go on prescription medication for mental illness/disorders and to self-treat. "
 9/1/2017 , Pmela M. A. |  Age: 45-54 |   On supplement for less than 1 month |   ," Condition: Fibromyalgia , Overall rating 5.0 ,Effectiveness,Ease of Use,Satisfaction,Report this post","Nothing was working for my depression (Not 3 Prozacs, plus 2 Wellbutrion, NOTHING) As soon as I started taking 5HTP my mood IMEDIATELY IMPROVED within days and I was able to do more around the house and not be as TIRED! HTP is AMAZING and SAFE! I would recommend it to ANYONE suffering from chronic pain and severe depression! SPREAD the WORD!!!"
 8/28/2017 , Fran |  Age: 55-64 |   On supplement for 1 to 6 months |   ," Condition: Other , Overall rating 4.7 ,Effectiveness,Ease of Use,Satisfaction,Report this post","I've suffered from Fibromyalgia and depression all my life.  I had heard the benefits of 5HTP and tried it.  About 1 week of taking 100mg I had NO more pain.  THIS is my CURE for Fibro!  I also, miraculously, had a substantial mood lift and now I don't take antidepressants anymore.  My only fear with 5HTP is the possible side effect of Heart Valve Leak Damage.  It has been reported that this is indeed a risk.  I am so sad about this.  I am afraid to continue but I feel so GOOD when I am on 5HTP.,  I wish so much that 5HTp could be further investigated as to HOW to stop the risk of leaky heart valve disease due to 5HTP.  I love how I feel on it."
 8/21/2017 ,  Age: 45-54 |   On supplement for 1 to 6 months |   ," Condition: Other , Overall rating 5.0 ,Effectiveness,Ease of Use,Satisfaction,Report this post",Went thru some tough times really depressing. Felt blah all the time. I'm in perfect health but just always felt off. Started taking spring valley 5-htp 300mg every other day. Wow! what change I feel great.
 6/29/2017 , Dave |  Age: 35-44 |   On supplement for 1 to 6 months |   ," Condition: Other , Overall rating 5.0 ,Effectiveness,Ease of Use,Satisfaction,Report this post","quite simply brilliant , cured my anxiety that i have had since a teenager and my two daughters almost overnight.    My only critism is this wasnt around 30 years ago , its changed my whole life ."
 6/15/2017 , Ana |  Age: 35-44 |   On supplement for less than 1 month |   ," Condition: Other , Overall rating 5.0 ,Effectiveness,Ease of Use,Satisfaction,Report this post","Started taking it along with GABA to ease withdrawal symptoms from nicotine. I started with 5 htp and GABA 2 days before quitting and so far it has helped me a lot. I tried quitting many times before and it was always a nightmare, at least the first 3-5 days. This time I've been feeling relaxed, the cravings aren't as hard as they were the previous times, I would totally recommend it. "
 5/11/2017 , sam |  Age: 55-64 |   On supplement for 1 to 6 months |   ," Condition: Other , Overall rating 5.0 ,Effectiveness,Ease of Use,Satisfaction,Report this post",
 5/6/2017 , Jen |  Age: 55-64 |   On supplement for less than 1 month |   ," Condition: Menopausal symptoms , Overall rating 2.0 ,Effectiveness,Ease of Use,Satisfaction,Report this post",This didn't suit me at all. I took 2 x 50mg capsules at night and then suffered excruciating muscle cramps that left me exhausted and aching the next day. Side effects stopped as soon as I stopped taking the 5-HTP.
 4/21/2017 , dmw |  Age: 45-54 |   On supplement for less than 1 month |   ," Condition: Other , Overall rating 1.0 ,Effectiveness,Ease of Use,Satisfaction,Report this post",I am in my 50's and menopausal.  I have not had a period in over 2 years.  Every time I try taking this I start a light period.  So I stop.  At first I thought is was a fluke so I waited 6 months and tried it again.  Same thing.
 3/9/2017 , Patty W |  Age: 65-74 |   On supplement for 5 to less than 10 years |   ," Condition: Other , Overall rating 4.7 ,Effectiveness,Ease of Use,Satisfaction,Report this post",IOf I don't take my 5 HTP I can actually say I feel sad and more anxious.  Works as good for me as the prescription drug did - and slightly better.
 3/9/2017 , Master Ramirez |  Age: 25-34 |     ," Condition: Other , Overall rating 5.0 ,Effectiveness,Ease of Use,Satisfaction,Report this post",I had ADHD and stressed out and depress now I can go to school and be able to absorb information and use my memory in a flash also keeps me calm to handle situations in a relax way thank you.
 3/4/2017 , Chale |  Age: 65-74 |   On supplement for less than 1 month |   ," Condition:  , Overall rating 4.0 ,Effectiveness,Ease of Use,Satisfaction,Report this post",
 2/6/2017 ,      ," Condition: Other , Overall rating 1.0 ,Effectiveness,Ease of Use,Satisfaction,Report this post",Which brand do people use?  How can we be sure of the purity of the ingredients?
 12/30/2016 , Marie |  Age: 45-54 |   On supplement for less than 1 month |   ," Condition: Other , Overall rating 1.0 ,Effectiveness,Ease of Use,Satisfaction,Report this post",Every time I took a 100mg capsule it made me feel nauseous. I had to stop.
 12/18/2016 ,  Age: 55-64 |   On supplement for 1 to less than 2 years |   ," Condition: Other , Overall rating 3.7 ,Effectiveness,Ease of Use,Satisfaction,Report this post","Began using 5HTP when I lost my insurance for a while and had to go off of Pristiq. AWFUL drug to stop taking abruptly. I was greatly helped by 5HTP! I really don't think there's anything on the planet that could have removed all of the symptoms of that experience, but this was a lifesaver. I noticed an improvement the 2nd or 3rd day, and have been taking ever since. It's also helpful for anxiety and good sleep. I do find that I need to go off for a few days or so as it seems to lose it's effect,iveness.  A word of caution, try to hang in there if you get stomach issues. They go away after the first week, and the and the quick desolve tablets are easier on the tummy. Also start out with a lower dosage if you do have issues. Great stuff peeps!! "
 12/14/2016 , Smurf |  Age: 45-54 |   On supplement for 1 to 6 months |   ," Condition: Other , Overall rating 3.7 ,Effectiveness,Ease of Use,Satisfaction,Report this post",Ok
 11/8/2016 , Samme |  Age: 19-24 |   On supplement for 6 months to less than 1 year |   ," Condition: Other , Overall rating 5.0 ,Effectiveness,Ease of Use,Satisfaction,Report this post","Struggling with depression for over 5 years, never taken any ssri's or prescribed medication. Began taking 200 mg a day, 100 once and 100 later. Always on an empty stomach, half hour before eating with a B6. Worked almost immediately. Makes you a little sleepy.  I was crying for hours almost every day, didn't want to go to school or work, then I felt a smoothness to my life I hadn't felt before.  This amino acid saved me, honestly. Also be careful of extreme weight loss, especially if you're alr,eady smaller. I went from 120 to 93 pounds which was a little scary. You'll lose weight without even paying attention, it was fun. Highly recommend!! "
 10/28/2016 , Gord235 |  Age: 65-74 |   On supplement for less than 1 month |   ," Condition: Other , Overall rating 5.0 ,Effectiveness,Ease of Use,Satisfaction,Report this post","Male, age 66. I have been on Citalopram 20mg.daily for about 15 years. To wean myself off I reduced dosage to 10mg. and started on 5 HTP 50mg. at the same time; then reduced the Citalopram to 10mg. every second day for 7 days. Transition was seamless with no side effects except a better sleep."
 10/23/2016 ,  Age: 35-44 |   On supplement for less than 1 month |   ," Condition: Other , Overall rating 3.0 ,Effectiveness,Ease of Use,Satisfaction,Report this post","I think this product would have done what I needed from it - to help with my anxiety but also insomnia. Unfortunately I'm one that suffers from RLS and certain supplements or foods (sugar, main culprit); 5HTP is one of them. I've actually never had RLS reactions so bad. If you have RLS, I highly suggest NOT taking 5HTP, otherwise I think this is a very good product. "
 9/15/2016 , Dafne |  Age: 55-64 |   On supplement for less than 1 month |   ," Condition: Other , Overall rating 2.3 ,Effectiveness,Ease of Use,Satisfaction,Report this post","Took this 24 hrs ago and still feeling VERY foggy. Can't drive. Suspect this is way to strong for me at 5' 130 lbs. Also dilated my eyes to pinpoints and severely bloated my stomach. As far as working it made me feel flat, almost emotionless. Too strong."
 8/31/2016 , GrandmaWussie |  Age: 45-54 |   On supplement for 1 to 6 months |   ," Condition: Other , Overall rating 4.7 ,Effectiveness,Ease of Use,Satisfaction,Report this post",I switched from SAM-e to 5-htp and I have been very happy with the results.  The biggest change is that I am sleeping better and dreams have come back.  I wish I had switched sooner to 5-htp.  The better sleep helps my mood and outlook immensely.    I am in a lighter mood and with a family history of mood disorders and perimenopause.....I'll take all the help I can get.
 7/27/2016 , Chris |  Age: 25-34 |   On supplement for 1 to 6 months |   ," Condition: Other , Overall rating 5.0 ,Effectiveness,Ease of Use,Satisfaction,Report this post","I take a 100mg pill in the morning every 4-7 days and its very good for treating depression. Effects usually hit 2-4 hours after taking it: general boost in mood, difficult to think negative thoughts, warm fuzzy feeling, sometimes even euphoria. Feelings of love, from loving what you're doing, to feeling better about people around you. Similar feeling to MDMA. I don't know why, it might just be my experience, but the effects seriously last 3 days or so. Then for about 3-4 more days just a genera,l content feeling. After about a week you're back at baseline but I swear that's better than before when I never took any anti-depressants.     BTW, messing with serotonin is dangerous, why I've never sought to get prescribed SSRIs or anything. That's why I only take 1 100mg pill every few days, it only takes a small amount to change the balance of serotonin in your brain. It takes other chemicals in your brain to work....so too much, and you might not even feel the desired effects, just the bad side effects. 100mg/day to me would be crazy. Side effects include a stiff jaw/temples, headaches, stomachache, vomiting, and can last as long it takes for your body to clear all the serotonin. I also don't take it at night as jaw clenching can be bad at night, sometimes even at my low dosage."
 6/24/2016 ,  Age: 55-64 |   On supplement for less than 1 month |   ," Condition: Other , Overall rating 5.0 ,Effectiveness,Ease of Use,Satisfaction,Report this post","No side effects.  Lessened anxiety, slept better, and somewhat helped me eat less.  "
 6/13/2016 , Jake |  Age: 25-34 |   On supplement for less than 1 month |   ," Condition: Other , Overall rating 5.0 ,Effectiveness,Ease of Use,Satisfaction,Report this post","I have high functioning autism and was prescribed anti depressants.  When mentioning 5HTP to my psychiatrist, was told that Zoloft more accurately focused on the neurological problem. This was even after taking it for over 6 months and telling her that I experienced tardive Dykinesis type facial tics (I have been prone to tic side effects from many medications before).  I continued on the Zoloft for 2 more months and the tics worsened.  Now I am taking 200mg.5HTP (time released)and it is helping,.  I increased to 400mg and it worked even better."
 6/11/2016 , R8che11e |  Age: 25-34 |     ," Condition: Other , Overall rating 2.7 ,Effectiveness,Ease of Use,Satisfaction,Report this post","I have been trying to cut out cigarettes completely. I was able to do so, but then I developed an addiction to Nicorette. When taking this pill, I have experienced shortness of breath, rapid heart rate, and light headed. "
 6/6/2016 , jessm19 |  Age: 19-24 |   On supplement for less than 1 month |   ," Condition: Other , Overall rating 4.7 ,Effectiveness,Ease of Use,Satisfaction,Report this post"," I am surprised to have experienced immediate elevation in mood in the first week of dosing 100mg of 5-HTP a day. I have been struggling with depression and anxiety lately and decided to go back to taking this after losing all motivation for things and needed a ""pick me up"". My previous experience I used the recommended dose of 100 3x a day and it caused me to have more anxiety and lethargic feelings which I cannot surely say it was from the 5-HTP. However, this time taking it I have found a swe,et spot in dosing and it has kick started a incredibly productive time full of optimism and positivity. I am pretty impressed to say the least. That one little pill a day has caused me to completely turn my mood around into something so positive so that I could go about my day with productivity again. I can also note that my sleep schedule and problems with insomnia have completely dissolved allowing me to have peaceful yet deep slumber every single night. I go to sleep and wake up in the same spot! I wake up feeling ready to start the day instead of wishing I had a few more hours to sleep. A side effect to take into consideration before trying out 5HTP is increased dreaming. It caused my first full blown lucid dream and has made my dreams more lucid and intense. To me it was a good side effect but it may be bothersome for others. Overall, I will continue to take one a day and see how far this goes. "
 5/26/2016 ,  Age: 65-74 |   On supplement for less than 1 month |   ," Condition: Fibromyalgia , Overall rating 4.3 ,Effectiveness,Ease of Use,Satisfaction,Report this post","I have tried 5-htp in the past but only 100 mg for a few days. When I am waking with anxiety all night long, every hour to 2 hrs, I know my serotonin levels are low. This last time, I took 100 mg. -150 mg. daily for 2 weeks, and sleep was wonderful. Then started to have sleep interruptions again and joint pain. Stopped it and slept wonderfully well. I will have to stay on short courses of treatment and experiment to see what works for me. I also have fibromyalgia."
 5/26/2016 , SALTP1 |  Age: 35-44 |   On supplement for 1 to 6 months |   ," Condition: Other , Overall rating 3.0 ,Effectiveness,Ease of Use,Satisfaction,Report this post",
 5/5/2016 , hide |  Age: 25-34 |   On supplement for less than 1 month |   ," Condition: Other , Overall rating 5.0 ,Effectiveness,Ease of Use,Satisfaction,Report this post",good for light depression. works for me.
 4/14/2016 , conwomen |  Age: 45-54 |   On supplement for less than 1 month |   ," Condition: Other , Overall rating 5.0 ,Effectiveness,Ease of Use,Satisfaction,Report this post",bought a bottle of natrol 5HTP at costco within the next day I felt very calm appetite suppressed its great no side affects  
 4/8/2016 , NutmegKate |  Age: 65-74 |   On supplement for less than 1 month |   ," Condition: Fibromyalgia , Overall rating 2.3 ,Effectiveness,Ease of Use,Satisfaction,Report this post","100mg Capsule: First dose, nauseous, faint, woozy, and weak. Second day: all of the above and vomiting. "
