dates,details,scores,reviews
 5/29/2012 , yvonne |  Age: 65-74 |   On supplement for 1 to 6 months |   ," Condition: Other , Overall rating 3.0 ,Effectiveness,Ease of Use,Satisfaction,Report this post","As I was taking 8x1500 daily fish oil capsules I was interested in the strength of red krill oil, so I would be able to take less capsules. When I took 1x500mg daily for a couple of weeks, was fine, til I started taking 2x500mg 4 days ago, this resulted in, odd pains everywhere including tummy,gassy  burps and nausea. very unpleasant side effects. Pity as sounds really great. It was Bioglan brand which was not down."
 5/18/2012 , vbe |  Age: 65-74 |   On supplement for less than 1 month |   ," Condition: Other , Overall rating 5.0 ,Effectiveness,Ease of Use,Satisfaction,Report this post",Decreased back pain (have rods and screws in back due to burst fracture of a vertebrae) and increased mental clarity.
 4/26/2012 , dissapointed |  Age: 35-44 |   On supplement for 6 months to less than 1 year |   ," Condition: Other , Overall rating 2.3 ,Effectiveness,Ease of Use,Satisfaction,Report this post","I started taking this 6 months ago,watching what i eat and excercising 4 times a week at the gym. My cholesterol didnt go down at all. my tryglycerides actually doubled.Not going to take it anymore even though my doctor told me to take them twice a day."
 3/8/2012 ,  Age: 55-64 |   On supplement for 1 to 6 months |   ," Condition: Other , Overall rating 5.0 ,Effectiveness,Ease of Use,Satisfaction,Report this post","I have high blood pressure,high cholesterol ,and end stage kidney failure. I switched from fish oil to krill oil (500mg Soft gell by Nature Made)three months ago and have had great results across the board!!!!! Blood results this month were amazing, This product is too expensive but I will never be without it!"
 3/7/2012 , ashbash |  Age: 25-34 |   On supplement for less than 1 month |   ," Condition: Other , Overall rating 3.7 ,Effectiveness,Ease of Use,Satisfaction,Report this post","This probably has nothing to do with the krill oil, but at the same time i started taking 1 pill a day i began to break out and became way more exhausted than usual.  I thought I would mention it just in case other people experienced the same thing and it happens it does have something to do with the krill oil.    who knows, i might be pregnant again or something since i get these same symptoms."
 3/3/2012 ,  Age: 65-74 |   On supplement for 2 to less than 5 years |   ," Condition: General Health And Wellness , Overall rating 4.3 ,Effectiveness,Ease of Use,Satisfaction,Report this post",
 2/20/2012 , lurl |  Age: 65-74 |   On supplement for 6 months to less than 1 year |   ," Condition: Other , Overall rating 3.0 ,Effectiveness,Ease of Use,Satisfaction,Report this post","I very much appreciate the lowering of the total cholesterol and modification of some pain due to Psoriatic Arthritis.  Unfortunately I had to stop after using it for three months and a month off then back on.  Horrible stomach pains just as it was with regular Omega 3 Salmon oils.  Horrible distended abdomen with tons of gas.  Inability to eat anything but liquids.  Pain is intolerable and I will quit again today and just get my Omega 3's from fresh fish and canned salmon and tuna.  I will also, use vegetable sources of this product.  Be very careful with these oils as they can cause bleeding or thinning of the blood in those especially those on Coumadin.  I was not but this is a warning.  It works so very well on the joint pain I hate to give up."
 2/17/2012 , Sunnybrook |  Age: 55-64 |   On supplement for 1 to less than 2 years |   ," Condition: Other , Overall rating 5.0 ,Effectiveness,Ease of Use,Satisfaction,Report this post","My Cholesterol, has always been a problem 240mg. I started taking krill oil because I could never remember to take 4 fish oil capsules a day.  1 krill capsule was the alternative I chose.  Never did expect to reap the bounty that I have received.  My cholesterol is now 209, my LDL has fallen to remarkably low levels, my HDL is above the recommended levels, and best of all, my triglycerides have also declined.  My blood sugar has always been a problem, but since I started this Krill oil it is mor,e in control.  I have not changed my diet.  This change has been maintained now for over nine months. "
 2/1/2012 ,  Age: 55-64 |   On supplement for less than 1 month |   ," Condition: General Health And Wellness , Overall rating 5.0 ,Effectiveness,Ease of Use,Satisfaction,Report this post",
 11/23/2011 ,  Age: 45-54 |   On supplement for 1 to 6 months |   ," Condition: Rheumatoid arthritis (RA) , Overall rating 5.0 ,Effectiveness,Ease of Use,Satisfaction,Report this post",EXCELLENT!
 11/17/2011 , Jean |  Age: 65-74 |   On supplement for 1 to 6 months |   ," Condition: Other , Overall rating 2.3 ,Effectiveness,Ease of Use,Satisfaction,Report this post","Wanted to lower cholesterol,took it for  4 months same reading,did not lower,but I do feel better,less joint aches so will continue taking it.  "
 9/12/2011 , Larry |  Age: 65-74 |   On supplement for 1 to 6 months |   ," Condition: Other , Overall rating 4.7 ,Effectiveness,Ease of Use,Satisfaction,Report this post",I have hip osteoarthritis and general aches for a 69 year old male.  I have found that taking 1000 mg per day has greatly reduced my symptoms. My blood pressure also seems lower but cant be certain as to cause.
 8/18/2011 ,  Age: 55-64 |   On supplement for 6 months to less than 1 year |   ," Condition: Other , Overall rating 5.0 ,Effectiveness,Ease of Use,Satisfaction,Report this post","I began taking krill oil 7 months ago after my physician indicated my cholesterol was too high at 225. After 7 months, my total level is at 210 and my LDL has gone down considerably. "
 8/7/2011 ,  Age: 55-64 |   On supplement for 1 to less than 2 years |   ," Condition: Other , Overall rating 5.0 ,Effectiveness,Ease of Use,Satisfaction,Report this post","I started taking krill oikl after I had open heart surgery (widow maker) and seeing it advertised on TV.  My cholestrol is actuall a couple of points below normal and the HDL hwas went up.  I do take lipitor and have watched my diet.  My arthritis is alos better, knee pain has been releived. The only problem is dertmining how much to take.  I take 4-300 mg per day."
 7/18/2011 , johne |  Age: 45-54 |   On supplement for 6 months to less than 1 year |   ," Condition: Other , Overall rating 5.0 ,Effectiveness,Ease of Use,Satisfaction,Report this post",
 6/27/2011 , Ken |  Age: 65-74 |   On supplement for 1 to 6 months |   ," Condition: Other , Overall rating 2.3 ,Effectiveness,Ease of Use,Satisfaction,Report this post","Started taking krill oil, 300 mg, in Jan, 2011. In March had blood tests, no change in Cholesterol levels.  Started having pain in toes in March, by April second toe swelled up and got red very sensitive, pain 9 over 10.  Diagnosed as gout, indomethacin Rx cleared up partly, but still hurts red and hurt 2 over 10.  Last Friday had shrimp dinner and toe got much worse. Had been avoiding all food like shell fish and beef that can cause gout.  Top one on list of foods that cause gout is shrimp.  Kr,ill is shrimp! We need more study to be sure krill oil OK to take in older people and those  especially subject to gout.  "
 6/21/2011 ,  Age: 45-54 |   On supplement for 1 to 6 months |   ," Condition: Other , Overall rating 4.0 ,Effectiveness,Ease of Use,Satisfaction,Report this post",No fishy burping
 5/31/2011 ,  Age: 19-24 |   On supplement for less than 1 month |   ," Condition: Other , Overall rating 4.3 ,Effectiveness,Ease of Use,Satisfaction,Report this post",Less neck and shoulder pain and stiffness than before using it. 
 5/24/2011 ,  Age: 75 or over |   On supplement for less than 1 month |   ," Condition: General Health And Wellness , Overall rating 4.7 ,Effectiveness,Ease of Use,Satisfaction,Report this post",
 5/12/2011 ,  Age: 45-54 |   On supplement for 1 to 6 months |   ," Condition: Other , Overall rating 4.0 ,Effectiveness,Ease of Use,Satisfaction,Report this post",IM AM A PHARMACIST AND HEARD OF THIS FROM A FRIEND WHO HAS A DAUGHTER IN DO SCHOOL IN TENNESSEE.  ON DAY 14 TREATMENT I WOKE THAT DAY AND EVERY DAY SINCE WITH NO MORNING STIFFNESS FROM MY OSTEOARTHRITS.   IM CONTINUE TO TAKE IT AT A DOSE OF 2 CAPSULES THREE TIMES A DAY AND MY SHOULDERS ARE IMPROVING GREATLY.  A MUST TRY.  I GET MY LAB RESULTS BACK IN A WEEK AND CANT WAIT TO SEE WHAT THEY SHOW. 
 4/17/2011 , bliss1119 |  Age: 55-64 |   On supplement for less than 1 month |   ," Condition: Other , Overall rating 1.0 ,Effectiveness,Ease of Use,Satisfaction,Report this post","I am taking Purity krill oil to improve brain function, memory, etc.   Nowhere in this article does it list that as a reason to take krill oil.  Please clarify!!   Thanks"
 4/16/2011 , idohair2 |  Age: 35-44 |   On supplement for 1 to 6 months |   ," Condition: Other , Overall rating 5.0 ,Effectiveness,Ease of Use,Satisfaction,Report this post","I never write reviews but had to share.  I started taking NKO (Neptune Krill Oil) last month to help lower cholesterol.  Within 2 weeks I noticed the pain in my neck from a whip lash injury last year was FINALLY gone.  It has to be the krill oil.  I've done PT, chiropractor, massage therapy and of course rest and have lived with pain everyday.  Now virtually none.  I also was surprised I had NO cramps with my period this month.  Last 2 months cramps were worse than my labor pains.  This month, n,ot even a slight cramp. I pray to God they deem this vitamin safe to take FOREVER!!!!"
 3/10/2011 ," , |  Age: 75 or over |   On supplement for 1 to less than 2 years |   "," Condition: Other , Overall rating 4.3 ,Effectiveness,Ease of Use,Satisfaction,Report this post",A knee which has bothered me since removal of a meniscus (5 yr. prior) is now much less painful to walk.  I also note that my vision has improved to the point that I can read words on TV without my glasses.  My lipid studies have been excellent in the past year that I have used Krill oil. I had a very painful stiff neck that was only minimally relieved with Chiropractor and acupuncture treatments--that is now all but gone.
 2/24/2011 ," caii1sa, |  Age: 65-74 |   On supplement for 1 to 6 months |   "," Condition: Rheumatoid arthritis (RA) , Overall rating 5.0 ,Effectiveness,Ease of Use,Satisfaction,Report this post","There needs tobe more reserch on Krill, but I have to say it is a miricle for me. Take it twice a day faithfully and I have had such improvement with the pain and arthritis. "
 2/14/2011 ,  Age: 35-44 |   On supplement for 1 to less than 2 years |   ," Condition: Other , Overall rating 5.0 ,Effectiveness,Ease of Use,Satisfaction,Report this post",
 12/9/2010 , damediva53 |  Age: 55-64 |   On supplement for 1 to 6 months |   ," Condition: Other , Overall rating 5.0 ,Effectiveness,Ease of Use,Satisfaction,Report this post",good stuff!!!!!!!!
 11/26/2010 , Andy D |  Age: 55-64 |   On supplement for 1 to 6 months |   ," Condition: Other , Overall rating 5.0 ,Effectiveness,Ease of Use,Satisfaction,Report this post","I took this at the recommendation of a friend, same age, and fellow runner who like me, has mild arthritis and joint pain.  Joint pain and inflammation has subsided along with treatment.  Minor side effects of gas, and occasional loose stool, but minor.  Other side effects include very positive Cholesteral improvements and Triglicerides improvement.  Blood pressure continues to get lower.  I've also lost weight and improved my fitness training, so could be a side product of healthier fitness and, diet.  However, it is working for me, so am giving Krill some credit."
 9/29/2010 ,  Age: 65-74 |   On supplement for 6 months to less than 1 year |   ," Condition: Other , Overall rating 5.0 ,Effectiveness,Ease of Use,Satisfaction,Report this post",
 8/29/2010 , Chief |  Age: 55-64 |   On supplement for 6 months to less than 1 year |   ," Condition: Other , Overall rating 5.0 ,Effectiveness,Ease of Use,Satisfaction,Report this post","I began taking Krill because og the smaller size compared to fish oil, and was overwhelmed by the reponse I received.  I was suffering from severe inflammation caused by arthritis in my left wrist, it was so severe that it was causing carpal tunnel syndrome and I was scheduled for surgery.  No Longer, with the inflammation 95% reduced, the carpal tunnel symptoms went away.  I was totally surprised by the results and highly recommend this product."
 8/26/2010 , shirley9237 |  Age: 65-74 |   On supplement for less than 1 month |   ," Condition: Other , Overall rating 3.7 ,Effectiveness,Ease of Use,Satisfaction,Report this post","since ive started taking mega red, i have been experiencing itching on my arms mostly. has there been any other people having this reaction???"
 5/17/2010 ,  Age: 55-64 |   On supplement for 1 to 6 months |   ," Condition: Other , Overall rating 4.0 ,Effectiveness,Ease of Use,Satisfaction,Report this post",
 3/25/2010 ,      ," Condition: Other , Overall rating 1.7 ,Effectiveness,Ease of Use,Satisfaction,Report this post",It made me sick to my stomach & had horrible stomach cramps with diarrhea.
 3/15/2010 ,  Age: 25-34 |   On supplement for 6 months to less than 1 year |   ," Condition: Other , Overall rating 3.3 ,Effectiveness,Ease of Use,Satisfaction,Report this post",good
 3/12/2010 ,  Age: 25-34 |   On supplement for 6 months to less than 1 year |   ," Condition: Other , Overall rating 3.3 ,Effectiveness,Ease of Use,Satisfaction,Report this post",good
 2/22/2010 , analee |  Age: 55-64 |   On supplement for less than 1 month |   ," Condition: Other , Overall rating 3.0 ,Effectiveness,Ease of Use,Satisfaction,Report this post","Started taking MegaRed krill oil caps. Nightmare, and profuse sweating from day one. Four days and I'm quitting the caps.  To sit and sweat over nothing is disgusting to say the least, and now leg cramps.  Sounds like a good product, but at 63, perhaps it's too strong for me."
 2/16/2010 , dada |  Age: 35-44 |   On supplement for 1 to 6 months |   ," Condition: Premenstrual syndrome (PMS) , Overall rating 5.0 ,Effectiveness,Ease of Use,Satisfaction,Report this post","i did not spot before my period for 3-4 days,I just got regular period.  "
 12/27/2009 , Josie |  Age: 65-74 |   On supplement for 1 to 6 months |   ," Condition: Other , Overall rating 5.0 ,Effectiveness,Ease of Use,Satisfaction,Report this post",Have been taking krill oil for three months. Had cholestrol checked after taking for two months and cholestrol was down to normal.
 10/27/2009 , anna |  Age: 45-54 |   On supplement for 1 to 6 months |   ," Condition: Other , Overall rating 5.0 ,Effectiveness,Ease of Use,Satisfaction,Report this post",Excellent product. My cholesterol was lowered within a month and I've noticed my arthritis symptoms in my hands have lessened considerably. Will definitely take for the rest of my life!!
 10/19/2009 , JustMe |  Age: 65-74 |   On supplement for 1 to 6 months |   ," Condition: Other , Overall rating 5.0 ,Effectiveness,Ease of Use,Satisfaction,Report this post","A friend was taking this on the advice of her orthopedic doctor. A month later she was walking without the aid of her cane with no limping or gait problem. My husband & I decided to try it for knee, joint, and general aches & pains.  Within one month, I have been able to kneel, walk up & down stairs, and work all day with no aches or pains.  No Aleve or Motrin!  My husband is able to turn his usually stiff neck a full 90 degrees & is currently standing on a ladder scraping the house. (He is 72) ,We have had no stomach upsets or any other side effects. Don't understand why it works, but we are happy with the results!"
 8/16/2009 , Thorton40 |  Age: 35-44 |   On supplement for less than 1 month |   ," Condition: Other , Overall rating 1.0 ,Effectiveness,Ease of Use,Satisfaction,Report this post","Tried it 3 times, can't tolerate it. It sets my IBS off in ways that are unbearable. very hard on my digestive system, caused horrible spasms, gas, burning and overall sickness. But I do have IBS and other digestive issues. Normal people may be just fine. Do not recomend for people with Digestive disorders!"
