dates,details,scores,reviews
 3/6/2012 ,  Age: 25-34 |     ," Condition: Other , Overall rating 2.3 ,Effectiveness,Ease of Use,Satisfaction,Report this post","I took this for anxiety and it didn't work for me.  About 30 minutes after waking up, my heart rate was up to 120 bpm.  I was pretty much having full blown panic attacks in the mornings.  I took it later in the afternoon, so I don't know if this was because I was withdrawing from the last dose.  Oddly enough, I had this same reaction recently when I was on Prozac.  Oh well, Xanax works for me, I'll keep trying to find a natural cure.  ;)"
 2/27/2012 , jeanelane |  Age: 55-64 |   On supplement for 1 to 6 months |   ," Condition: Other , Overall rating 5.0 ,Effectiveness,Ease of Use,Satisfaction,Report this post","My chiropractor also has advanced training in clinical nutrition, and has been recommending supplements for me. He has me on a product that is called Total 5-HTP by Nutri-West. Besides 50 mg per tablet, there is 1 mg melatonin and other things.  Works wonders for my insomnia. I take 2 tablets with supper and one right before bed. It helps me get to sleep and stay asleep."
 2/15/2012 , 2FullTime Jobs |  Age: 45-54 |   On supplement for 1 to 6 months |   ," Condition: Other , Overall rating 5.0 ,Effectiveness,Ease of Use,Satisfaction,Report this post","I am a care taker for my father who lives with me. He suffers from dementia and chronic pain.  I use 5-HTP to help me sleep.  Because I sleep better, the tossing and turning has been considerably reduced.  I am happier (or a lot less grumpy!) when I wake and I stay in a reasonably good mood all day. My patience has improved.  I strongly recommend that anyone wishing to take this supplement discuss this with their doctor beforehand, because of what it is and how it works.  For me, it has changed ,my outlook, improved my sleep and even my diet has improved...as in no eating because I can!    I started using Natrol Fast-Melt 100mg, but switched to Natrol 100mg capsules.  I take it before bedtime.  The Fast-Melts seem to work a little better because there is less ""processing"" involved, but the capsules are fine."
 2/13/2012 , Alvin |  Age: 45-54 |   On supplement for less than 1 month |   ," Condition: Other , Overall rating 5.0 ,Effectiveness,Ease of Use,Satisfaction,Report this post","I am a 47 year old male.   I started taking 5-HTP because it is a natural, accessible solution to anxiety, possibly related to ADD.  I noticed the results within 15 minutes! I felt a calm that I have not known for YEARS! I was just peaceful, kind of like I didn't really care about anything, but I DID still care; I just wasn't hyper-vigilant, or uptight about anything! It hasn't reduced my motivation to take on tasks either! I can focus on what I am supposed to do easier because my mind isn't thi,nking about 10 other things at the same time.  No side effects yet, but I have only taken it for about 3 days. I haven't taken more than 1 100mg capsule a day yet because I haven't felt the need to.  Do be warned, however, 100mg makes me a little sleepy (I weigh 190lbs); combining 5-htp with drugs that enhance drowsiness could be disastrous under the 'right' conditions! "
 2/11/2012 , yabadoo |  Age: 35-44 |     ," Condition: Other , Overall rating 5.0 ,Effectiveness,Ease of Use,Satisfaction,Report this post","I developed PMDD after having Chemo. I tried various birth controls believed to work for this condition, however was not happy with the side effects and risks. 5-htp has given my life back. I believe it to be safer and more natural than the other alternative, anti-depressants "
 1/17/2012 , hadeeja |  Age: 55-64 |   On supplement for less than 1 month |   ," Condition: Other , Overall rating 1.7 ,Effectiveness,Ease of Use,Satisfaction,Report this post","woke me up with stomach pain several times in the night. very strange dreams that were somewhat tramatic. after I woke up on both occassions of taking this, I experienced difficulty functioning - dropping things, stumbling, not alert."
 1/14/2012 , Maria |  Age: 35-44 |   On supplement for less than 1 month |   ," Condition: Other , Overall rating 5.0 ,Effectiveness,Ease of Use,Satisfaction,Report this post",I began taking 5-HTP three days ago because I had compulsive behavior and drank too much. Within hours of taking this I felt 90% better. It has given me my life back! I HIGHLY recommend it. Thank you Lord.
 1/12/2012 ,  Age: 55-64 |   On supplement for 1 to less than 2 years |   ," Condition: Fibromyalgia , Overall rating 4.3 ,Effectiveness,Ease of Use,Satisfaction,Report this post",I have fibromyalgia complicated by a sensitivity to drugs. I found that Cymbalta took away the pain but the side effects for me are intollerable. My doctor suggested 5HTP as a viable alternative and I have found it works most days. I still have bad days when nothing seems to help but 5HTP and regular activity seems to ease the pain.    
 12/20/2011 ,  Age: 55-64 |   On supplement for less than 1 month |   ," Condition: Other , Overall rating 4.3 ,Effectiveness,Ease of Use,Satisfaction,Report this post",
 11/30/2011 , chuckles  |  Age: 65-74 |   On supplement for 1 to 6 months |   ," Condition: Other , Overall rating 4.0 ,Effectiveness,Ease of Use,Satisfaction,Report this post",I have intractable migraines and the neuro surgen wanted to do botox shots. I wanted an alternative so i researched with my physician and it was my decision to try 5htp. much to my surprise for the short time  i am really happy with my decision Thank You 5htp.
 11/11/2011 , percolator |  Age: 35-44 |   On supplement for less than 1 month |   ," Condition: Other , Overall rating 3.3 ,Effectiveness,Ease of Use,Satisfaction,Report this post","This worked WONDERS for my severe depression that I had been dealing with for the last year.  Unfortunately, it also causes me to have severe constipation ( I have long time slow transit colon problems and need surgery to correct it) that makes this a very challenging treatment for me to follow.  I'm going to try taking it just one or two times a week and see if I can manage it that way.  It also caused me to have some very vivid and disturbing dreams, but that was a worthwhile tradeoff consider,ing the total lightening in my mood and outlook from this medicine.  "
 10/28/2011 , Nomad |  Age: 55-64 |   On supplement for 1 to 6 months |   ," Condition: Other , Overall rating 4.0 ,Effectiveness,Ease of Use,Satisfaction,Report this post","I started on 5-HTP 200 mg for depression, Chronic Fatigue Immune Deficiency Syndrome (CFIDS) and Fibromyalgia (FM). It helps with mood, clarity and energy. However, if I take it after 2 p.m. I have the opposite effect of most reviews here - it keeps me awake. 200 mg/day, even once in the a.m. kept me awake. I now take 50 mg in am and 50 mg at lunch, which works. I do notice a real drop in mood and energy as it wears off. IF I don't take it the next day, I am severely depressed."
 10/19/2011 , Lolly |  Age: 75 or over |   On supplement for less than 1 month |   ," Condition: Other , Overall rating 3.7 ,Effectiveness,Ease of Use,Satisfaction,Report this post",I have been taking one at noon meal and one at nighttime meal to help me get to sleep.  It does seem to help me sleep for about 5 or 6 hours.  
 10/7/2011 ,  Age: 45-54 |   On supplement for less than 1 month |   ," Condition: Other , Overall rating 4.7 ,Effectiveness,Ease of Use,Satisfaction,Report this post",
 10/2/2011 ,      ," Condition: Other , Overall rating 5.0 ,Effectiveness,Ease of Use,Satisfaction,Report this post","Este medicamento 5-htp es una maravilla. Por  mucho tiempo he tenido el problema de ansiedad y pensamientos negativos. Me enfocaba en las malas cosas de la vida ademas me irritaba por cualquier cosa y no disfrutaba  mi familia. Fui a Costo el otro día y estaban pasando muestras gratis para probar este producto 5-htp . Ese mismo día lo tome como al medio día, el resto del día fue muy bueno, disfrute mucho mas a mi familia, mis dos hijos y mi vieja, sin molestarme como siempre lo hacia cada vez qu,e salimos, sin tener pensamientos negativos. Ademas esa misma noche dormí súper bien.   Lo recomiendo 100 %. "
 9/30/2011 , MiamiGirl |  Age: 35-44 |   On supplement for less than 1 month |   ," Condition: Other , Overall rating 5.0 ,Effectiveness,Ease of Use,Satisfaction,Report this post","I have been under a lot of stress lately causing irritability, depression, loss of sleep. i actually started taking 5HTP when i was ordering a few other supplements. i thought it was an antioxident at the time. I have been sleeping so good lately (I used to wake up 2-3 times in the night)and waking up in a great mood but couldn't figure out why until I read this article. I am recommending this to my friend who was feeling as I was. "
 9/27/2011 , ashtreewillow |    On supplement for less than 1 month |   ," Condition: Other , Overall rating 5.0 ,Effectiveness,Ease of Use,Satisfaction,Report this post","I have suffered from fits of depression and severe anxiety since the age of 14, and have tried countless medications. I was on prozac throughout high school. I am now 21 years old and have no been on any meds for almost two years, but my depression and anxiety were still there. I just didnt want to get back on prozac and seroquel because of the awful side affects. I needed an answer, and after only 5 days I feel an almost complete change in me. I am calm for once, I almost don't know what to do ,with this feeling!  My sleep is much better, and i am happy. I am no longer crying at every little inconvenience in my life. No longer am I sitting in silence with racing thoughts flooding through my head. I havent been taking 5 htp long, but the difference is phenomenal. I was very skeptical of the medication because of adverse side effects I've had from everything else the doctors are trying to feed every person with depression. It makes me wonder why doctors don't just reccomend 5htp. Oh yeah, because they don't get paid to hand out herbal supplements."
 9/16/2011 , Atam Gits |  Age: 35-44 |   On supplement for less than 1 month |   ," Condition: Other , Overall rating 1.7 ,Effectiveness,Ease of Use,Satisfaction,Report this post","I tried it for insomnia and it made me unable to sleep.  When I tried I found myself in some sort of mental zombiland that was somewhere betweeen sleep and consciousness.  When I did drift into a shallow sleep I had horrible nightmares.  My muscles were restless and I kept alternating between hot and cold spells.  The next morning I felt like I hadn't slept in days.  I went to work and couldn't focus and had to go home sick.  20 hours later my head feels swimmy and feel like I've been poisoned. , I will never take this again.  Dosage was one 100mg 12-hour time release Natrol tablet.  I got the pills at Costco (didn't see it in the drop down box so I selected what was closest).  The same day I took the pill I also took a Prisolec and ibuprofen.  I don't know if it was a drug interaction or what but this stuff should be dispensed by a pharmacy."
 9/14/2011 , lilly |  Age: 35-44 |   On supplement for less than 1 month |   ," Condition: Other , Overall rating 5.0 ,Effectiveness,Ease of Use,Satisfaction,Report this post",I started 5 htp after reading the book chanfe your brain change your body and cbange your brain change your life which I highly recomend. I had anxiety to the point where I never felt relaxed. 5htp 100mg before bed along with fish oil and I deel amazing. I sleep through the night and feel so at peace with everything. Please do your research I have read to many of these reviews where people are mixing 5 htp with st johns wart or same. Not ok.   
 9/7/2011 ,  Age: 25-34 |     ," Condition: Other , Overall rating 5.0 ,Effectiveness,Ease of Use,Satisfaction,Report this post","I started taking 5htp for anxiety and found that it helped me with my ADD which was completely unexpected. Normally, I felt hazy and sluggish which started to be a real problem as I began school at a prestigious college. After the first day of taking 5htp I felt more focused and alert. It acted like a stimulant for me and I even had trouble sleeping the first few weeks. However, others have told me it had the opposite effect on them so I hypothesize that it depends on your already existing serot,onin levels.   I did experience headaches at first but they have now gone away. This did concern me an I would like to know more about the cause.  I also ate less at first, but I now seem to be normalized. It wasn't like being on Ritalin or Adderall where you feel shaky and  the idea of food is repulsive. It's very subtle and you only eat when hungry without overdoing it.   Overall, 5htp has been a great medication for me. I feel less anxious and with it, I was able to make speeches in public without the crippling fear I had before. "
 9/3/2011 ,  Age: 19-24 |   On supplement for less than 1 month |   ," Condition: Other , Overall rating 4.0 ,Effectiveness,Ease of Use,Satisfaction,Report this post",
 8/31/2011 , ally |  Age: 35-44 |   On supplement for 1 to 6 months |   ," Condition: Other , Overall rating 3.0 ,Effectiveness,Ease of Use,Satisfaction,Report this post",Everytime I take 5 htp I get a bad headache. I have not noticed a headache if I take a supplement that contains 5 htp. So for me taking 5 htp by itself is not good.
 8/29/2011 ,  Age: 19-24 |   On supplement for less than 1 month |   ," Condition: Other , Overall rating 2.3 ,Effectiveness,Ease of Use,Satisfaction,Report this post","I have been diagnosed with depression and I didn't want to take any harsh medication, so I tried 5 HTP. Unfortunately I didn't look into it and when I would take it consecutively I would soon have random seizures, and I would black out. The seizures and black outs were not long, but I would have no idea it happened once I woke up. It was really scary. Please be very careful if you plan to take these pills. And btw I do not have down syndrome, like it says on the side effects section. Hope this h,elps!!!"
 8/14/2011 ,  Age: 25-34 |   On supplement for 1 to 6 months |   ," Condition: Other , Overall rating 5.0 ,Effectiveness,Ease of Use,Satisfaction,Report this post",I started taking 5-HTP to help with anxiety and depression symptoms.  I have had terrible reactions to anti-depressant in the past that dramatically increased my anxiety and caused severe manic symptoms.  I have had no problems with 5-HTP.  It helps with depression and anxiety symptoms and I have had no side effects.  It does not work for me as a sleep aid which allows me to take 200 mg twice a day.
 8/11/2011 , Murfle |  Age: 55-64 |   On supplement for 1 to 6 months |   ," Condition: Other , Overall rating 5.0 ,Effectiveness,Ease of Use,Satisfaction,Report this post","WebMD says not to take 5-HTP till more is known. However, the article is NOT dated!   There was a scare about 5HTP in 1988 due to a contaminated batch from Japan, coming from the labs of Showa Denko caused 37 deaths and 1500 permanent disablements.   Controversy at the time between big pharmas, the biotech and FDA resulted in a blanket ban of 5HTP. Pharmas would rather sell you the more expensive SSRI's. Biotech don't want you to know it was Genetic Engineering caused the problem. FDA played saf,e and banned everything just in case, or maybe under direction from lobbying by big P & BT.  User consensus says 5-HTP is very helpful, and videos on youtube from qualified professionals saying so.   Me? I found it immensely helpful and get mine from a reputable source.   If I hear that ""voice of depression"" I take 2 x 50mg tablets of 5 hydroxy tryptophan in the evening, it gives me a great night's sleep, possibly because it also converts to melatonin and significantly elevates my mood in the morning, presumably due to increased serotonin levels.   I wish WebMD would update their statement to ""avoid"" this very helpful food supplement, and stop misleading people who need help, but they have not responded to my attempts to contact them with links about the original 5HTP contamination.   Don't cross medicate with SSRI's or MAOI's and it is probably perfectly safe.   Look up Tryptophan poisoning on google for yourself.  "
 7/23/2011 , Rose |  Age: 55-64 |   On supplement for 5 to less than 10 years |   ," Condition: Fibromyalgia , Overall rating 5.0 ,Effectiveness,Ease of Use,Satisfaction,Report this post",I have been taking 2 5HTP 100 mg at bedtime for almost 10 yrs with Pindolol 10mg (for blood pres). This helps get into the rim stage of sleep so your muscles repair & you sleep more restful. I also take a 5 HTP 100 mg in the AM with my other supplements & prescriptions. It also helps with weight loss.
 7/22/2011 , FlowerPower |  Age: 19-24 |   On supplement for 1 to 6 months |   ," Condition: Other , Overall rating 5.0 ,Effectiveness,Ease of Use,Satisfaction,Report this post",Because I didn't tolerate Sansert (Methysergide) I switched to 5-HTP 200mg 3 times a day and have had at least a 50% reduction in chronic migraine with a much lower risk than Sansert.  Not quite as effective but well worth the trade-off for a much better side effect profile. 
 7/15/2011 , Donnie3698 |  Age: 25-34 |   On supplement for less than 1 month |   ," Condition: Other , Overall rating 5.0 ,Effectiveness,Ease of Use,Satisfaction,Report this post","Well I used to smoke ALOT of weed, and since then I haven't been the same. this ha actually made me happier than I was when I was smoking weed, mainly because I feel alive again, and i don't have to worry about the law or drug tests. This is what I have been looking for. I found this out by someone on this site actually and I want to thank them from the bottom of my heart, and my family thanks you too. They have never seen this side of me and they are loving it."
 7/11/2011 , latinsnake24 |  Age: 19-24 |   On supplement for less than 1 month |   ," Condition: Other , Overall rating 4.3 ,Effectiveness,Ease of Use,Satisfaction,Report this post","weird dreams and always tired,but OCD is dying down a bit (pure-o obsessive compulsive disorder) only been taking it a couple weeks,but seems to be helping"
 6/28/2011 ,  Age: 65-74 |   On supplement for 1 to less than 2 years |   ," Condition:  , Overall rating 5.0 ,Effectiveness,Ease of Use,Satisfaction,Report this post",Helps with sleeping problem.
 6/14/2011 , Deb |  Age: 45-54 |   On supplement for 5 to less than 10 years |   ," Condition: Other , Overall rating 5.0 ,Effectiveness,Ease of Use,Satisfaction,Report this post","I have taken 5-HTP for about nine years with no side effects. Before that I took Prozac and Effexor which made me sleepy, and feel like I was in a dream-like state all the time. I also tried ST. John's Wart and Kava Kava with little success. After takeing  5-HTP at 100mg three times a day for a couple of weeks I felt more like myself than I had in years. I also took a multi vitimin, B6, and Natural Calm. This was during my high stress years when I was working, had three teenagers and a child sev,en years younger than the older three. I now take 100mg twice a day and at times once a day along with Magnesiun and Omega 3. It has helped me maintain symptomys of depression, PMS, sleeless nights, weight gain during Perimenapause,all without loosing my sexdrive. My family and I are all glad that I found 5-HTP when I did. It has help me lead a normal life without the up and down cycles of depression."
 6/11/2011 , E2BD |  Age: 55-64 |   On supplement for less than 1 month |   ," Condition: Other , Overall rating 4.0 ,Effectiveness,Ease of Use,Satisfaction,Report this post","If I felt the ""voice of depression"" coming back, I would take a couple of Holland and Barrett's 50 mg 5HTP capsules in the evening before bed.   I slept very well, and woke refreshed, feeling much better, happy and alert.   I understand it might help with Melatonin levels as well as Serotonin. I don't rely on it all the time, just maybe for a day or two if I feel really bad, and then only occasionally, as I believe I have addressed the major problems by correct attention to my diet. "
 6/6/2011 , HTPSupport |  Age: 25-34 |   On supplement for less than 1 month |   ," Condition: Other , Overall rating 5.0 ,Effectiveness,Ease of Use,Satisfaction,Report this post","This pill is unbelievable.  I suffered from horrible depression for close to 10 years.  I had 0 serotonin from chronic use of THC.  This drug (within 10 minutes) completely changed me from a suicidal, depressed and angry person...to myself again.  Please if you're depressed for the same reasons this drug will save your life."
 5/30/2011 , Hindy |  Age: 55-64 |   On supplement for less than 1 month |   ," Condition: Other , Overall rating 5.0 ,Effectiveness,Ease of Use,Satisfaction,Report this post","I was having a lot of sleep problems. A lot of nights I couldn't get to sleep until 4 or 5 in the morning and then I could hardly function all day. I also would wake up about every 90 mins usually after having very unsettling and vivid dreams. I started taking a sleep aid that contains 10mg of 5-htp and what a difference! the very first night I went to sleep easily without tossing and turning for hours as I usually did. I have been sleeping through the night and rarely have to get up. My dreams ,are not upsetting anymore and I feel very well in the morning. This very tiny dose works for me and has made a big difference. I tried taking a sleep aid that didn't contain 5-htp to see if it made a difference and after one night I went back to taking the aid with the 5-htp because the 5-htp does make a difference. I hope they don't stop selling this, I have had no bad side effects whatsoever and have been taking it for almost a month."
 5/29/2011 , celticpaul |  Age: 35-44 |   On supplement for less than 1 month |   ," Condition: Other , Overall rating 5.0 ,Effectiveness,Ease of Use,Satisfaction,Report this post","I have been in a ""funk"" for about 9months since moving from the Desert SW to PA and missing friends - climate etc. I also had issues getting out of bed in the morning and hitting the gym, walking the dog etc.. and have gained 30lbs..   I had been reading about 5-HTP and seeing the results from comments such as below have been having on peoples lives so decided to try for myself.. what did I have to lose right.. ? My MD had scribed Xanax for me... but it was really causing me to detach from life ,altogether..     I was at Costo last week and found Natrol 5-HTP - although dubious yet excited.. I tried the product and have been taking it for a week..     Well I honestly have to say.. WOW.. what a difference... No more Mr Snapper Head and now I am feeling like ""normal"".. I have no idea how it performs on appetite control as I am a foodie.. but I can say without a doubt that my mood has lifted and I am out of my funk and thats after 1 week.. I have found that the stupid small stuff in life that would occupy my mind for no reason at all has pretty much gone.. I have started to accept things for what they are and move on.. instead of dwelling and festering on things..   So - my opinion - for what it is worth.. go to Costco or the drug store - try it for yourself.. I think you will see a difference.. as so many people like myself have.    I am heading on a family reunion vacation in a week.. my Sister said.. ""bring your Xanax"" - lol - nope - ""ill bring my 5-htp !"""
 5/23/2011 , AlrightNow |  Age: 19-24 |   On supplement for less than 1 month |   ," Condition: Other , Overall rating 4.3 ,Effectiveness,Ease of Use,Satisfaction,Report this post","i became severely depressed like total breakdown almost all the time depression. no zest for life and so on. and i know to begin with ive always had MINOR depression problem but i did some partying a while back and i ate extascy. well doing that extremely depleated my serotonin and was causing the crazy depression and i knew it. my friend recommended 5htp to build it back up, and like others - i feel normal again. except i do exp. one side effect. and thats the nausia. right after i take it i ge,t a sicky feeling in my stomach that stays for like an hour. what i read on here about it possibly being dangerous does worry me because ive done enough harm to myself. im hoping my brain can start to be normal again because of 5htp and i can eventually stop taking it."
 5/20/2011 , jen879902 |  Age: 25-34 |   On supplement for 1 to 6 months |   ," Condition: Other , Overall rating 5.0 ,Effectiveness,Ease of Use,Satisfaction,Report this post","My story seems to be the same as everyone else's. I have dealt w depression and anxiety for as long as I can remember and have always been on something for it.  When I was on medication I was extremely forgetful and clumsy, and I never thought it was the meds. Then I was told to try this out and since I have been on it (3 months now) I have my brain and happiness back! This has been the greatest alternative to pharmaceutical medicine ever! It has saved me! (by the way I take the max dose 300mg b,c of how bad my depression is)"
 5/1/2011 , Aboa |  Age: 65-74 |   On supplement for 2 to less than 5 years |   ," Condition: Other , Overall rating 4.7 ,Effectiveness,Ease of Use,Satisfaction,Report this post",I have tried different meds for depression and anxiety till a Psychologist recommend me to try 5-HTP.  It really helps me a lot.  I used to take Lexapro but there were too many side effects that I have experienced.
 4/12/2011 , DOVECOTTAGE |  Age: 45-54 |   On supplement for less than 1 month |   ," Condition: Weight loss , Overall rating 4.0 ,Effectiveness,Ease of Use,Satisfaction,Report this post",I began to sleep better and had a lot more energy.I watched my sugar intake and have lost 6lbs in 12 days!! I FEEL GREAT.
