dates,details,scores,reviews
 9/16/2023 , Tess |  Age: 65-74 |   On supplement for less than 1 month |   ," Condition: Other , Overall rating 2.7 ,Effectiveness,Ease of Use,Satisfaction,Report this post","Tried using and for a few days okay results and better sleep then upset stomach, burning mouth, nausea.
I guess it’s not for me."
 8/7/2023 , Dr.Shulgin |  Age: 35-44 |   On supplement for less than 1 month |   ," Condition: Other , Overall rating 5.0 ,Effectiveness,Ease of Use,Satisfaction,Report this post",Fantastic after a hard weekend rolling. Be kind to your brain after is been kind to you giving you all that pleasure.
 7/18/2023 , # Blessings |  Age: 55-64 |   On supplement for 2 to less than 5 years |   ," Condition: Other , Overall rating 5.0 ,Effectiveness,Ease of Use,Satisfaction,Report this post",It helps me get a restful sleep.
 7/18/2023 , dissatisfied |  Age: 13-18 |   On supplement for less than 1 month |   ," Condition: Other , Overall rating 2.3 ,Effectiveness,Ease of Use,Satisfaction,Report this post","I have depression and I stumbled upon 5 HTP at a walgreens, claiming to help with mood problems. I took it and didn't feel that much better, though a noticable improvement. When it wore off, my depression got even worse than it was before. For three days after, I could barely function. Would not recommend, found much better results using St. John's Wort."
 6/21/2023 , 5 htp |  Age: 25-34 |   On supplement for less than 1 month |   ," Condition: Other , Overall rating 5.0 ,Effectiveness,Ease of Use,Satisfaction,Report this post","A patient who suffered from depression and tried everything possible,but nothing was as effective as taking 5 htp supplement. I was on antidepressants ,but when I csme off all the depressive symptoms came back. 
As soon as started taking it, I started feeling that my depressive thoughts were gone…. Personally I take 200 mg in the morning and 200 mg in the evening. This is what workd for me,however you could be fine with lower dose as well. Dr Janelle Sinclae suggests to take 3x50 mg or 100  also, three times if you feel that is not enough. 
Defenetly it will ease your life and thought.

You must give a chance. At the befinning it gave me some headaches but it went away,as well as a little sleepiness,but now I feel amazing and completely normal again.

Trust me, I am a person who was diagnozed with depression and got hospitalized with anxiet and depression, /psychosis….it was awful

I am hoping that it can help to some of you?? plus taking Rhodiola rosea is also amazing for anxiety attacks."
 4/21/2023 , Jim |  Age: 55-64 |   On supplement for 1 to 6 months |   ," Condition: Other , Overall rating 3.7 ,Effectiveness,Ease of Use,Satisfaction,Report this post","100mg ONCE DAILY (not twice a day).  I was recommended to take twice a day but I had bad side effects.  

5-HTP speeds up your brain.  It makes your Calicum absorb easier into your brain cells.  Instead of typical 5-10% of Calicum soaking into your brain cells you can get more like 20% absorbed.  (the rest expelled via urine)

NOTE:  Calcium metabolism in your brain CREATES HEAT.  When I took 100mg twice a day the end result was a feeling that my head was on fire.  I could literally feel the hea,t, and ended up running cold water over my head in the shower- not pleasant!

However, once I started taking it just every other day all of the sudden I can THINK again.  The fog is cleared and all of the sudden my friends are surprised that I'm not lost in a fog.

USAGE WARNING:  Do not take more than recommended and really I would just take half until your brain gets used to it.  If you take with a good multi vitamin- just EVERY OTHER DAY hopefully you will have the good results that I am getting.

I now take with with Citicoline and L-Theanine and find very good mental / memory function, clear head and emotions, and Ashwagandha for sleep.

Overall would recommend- but start with 1/2 dose or you might be soaking your head in cold water!"
 2/15/2023 ,  Age: 65-74 |   On supplement for 1 to 6 months |   ," Condition: Other , Overall rating 5.0 ,Effectiveness,Ease of Use,Satisfaction,Report this post","I am not depressed,but I crave sugar because of a seratonin deficiency.  
I really CRAVE it, especially in the afternoon and evening.  5htp makes those cravings entirely manageable.  It is miraculous.  If I forget to take my pill I end up getting into something (ice cream or worse).  When 
I take it I resist.  I love this stuff.
"
 12/30/2022 , Mummybunny |  Age: 45-54 |   On supplement for 1 to 6 months |   ," Condition: Other , Overall rating 5.0 ,Effectiveness,Ease of Use,Satisfaction,Report this post","I worked with a specialist to find a solution for depression because I cannot take SSRIs. It works. But reading reviews I have to say - it’s natural of course it’s not FFA approved? Does FDA approve dried fruit, tea, dried milk?? No. Matural things existed long before big pharma came along!!

If your doctor gave you 5htp for melatonin, your doctor should be reported, they’re the problem not 5htp. 5htp can increase serotonin. If you take SSRIs or other pharmaceuticals you should ask a pharmacist ,or doctor to look up interactions. 

 Est advice - buy from reputable brands that have been around for a while. Don’t buy from obscure places and brands not known. "
 12/5/2022 ,  Age: 35-44 |   On supplement for less than 1 month |   ," Condition: Other , Overall rating 1.7 ,Effectiveness,Ease of Use,Satisfaction,Report this post","First it did nothing, then it kept me awake and anxious for a few days. Did not like the headaches either. "
 11/30/2022 , No controlled! |      ," Condition: Other , Overall rating 2.7 ,Effectiveness,Ease of Use,Satisfaction,Report this post","It is not good that it's not regulated/controlled! Very strong efekt in fey days of us as it is hormonal!  Worst is no government agency take care to explain the dosage in force of law In direct connection with sale.

 What is stupid people in government and this is not single example. Anyway we should be thankful we don't have an anarchy on the streets. 

 Conclusion be careful check your dosage Go slow and be patient."
 11/20/2022 , Stephon  |  Age: 35-44 |   On supplement for 1 to 6 months |   ," Condition: Other , Overall rating 4.3 ,Effectiveness,Ease of Use,Satisfaction,Report this post","Being 100 percent honest because reviews for things like these are important. 
It’s been 2 months using HTP-5. When I first started I took 2 capsules every night for the first two weeks( for full effect like bottle mentions), then I changed it to every other night from then on. It works great. I don’t get extremely irritated for no reason anymore and my attitude is pleasant and not Just neutral. So focusing is easier now. IM early to bed early to rise but had trouble falling asleep. Now I’m earl,y to bed and Im asleep within the hour and I wake up with no mind fog!  BAD PART, for the first two weeks I noticed a little stomach pinching and I figured it was the HTP-5 like the side effects say that’s why I changed it to every other night. I don’t mind it though, I fix cars for a living so I feel worse “pinches” than that everyday. So every other night after a full dinner solves the stomach thing for me. "
 11/19/2022 ,  Age: 45-54 |   On supplement for less than 1 month |   ," Condition: Other , Overall rating 1.0 ,Effectiveness,Ease of Use,Satisfaction,Report this post","I took this to try to help with high levels of stress and anxiety caused by work. In actual fact, all that happened was an increased amount of anxiety caused by the unholy amount of farts that this supplement  caused.  "
 10/27/2022 , Caffe_Cola |  Age: 35-44 |   On supplement for less than 1 month |   ," Condition: Obsessive-compulsive disorder (OCD) , Overall rating 1.0 ,Effectiveness,Ease of Use,Satisfaction,Report this post","I took 100 mg of HTP and it develop Fibromyalgia syndrome chronically causing pain, stiffness, and tenderness of muscles, tendons, and joints without detectable inflammation within 24 hours after taking 2 tablets such a horrible."
 10/18/2022 , Mike |  Age: 65-74 |   On supplement for 2 to less than 5 years |   ," Condition: Other , Overall rating 5.0 ,Effectiveness,Ease of Use,Satisfaction,Report this post","I was in a deep depression  4 years ago and tried anti -depressants that made me feel much worse. After I gave them up I decided to try 5HTP and it helped me enormously. I took 100mg a day up until about a year ago, when it suddenly dawned on me that I had not l needed it for a long time. Starting and stopping with 5HTP needs to be tapered. I built up from 50mg to 150mg over a couple of weeks and after a couple of months dropped back to 100mg. When I stopped a year ago I took over a month of  de,creasing doses and missing days to reach giving up.
PS I had problems with your stars but my rating was excellent on all points"
 10/9/2022 , raye |  Age: 45-54 |   On supplement for 6 months to less than 1 year |   ," Condition: Other , Overall rating 4.0 ,Effectiveness,Ease of Use,Satisfaction,Report this post",I take it on and off when ever I feel like I've been down in the dumps for a week or if I need to be in a good mood for something...it does take a few days to kick in but did and does work... 
 9/12/2022 , zener777 |  Age: 35-44 |   On supplement for less than 1 month |   ," Condition: Other , Overall rating 1.7 ,Effectiveness,Ease of Use,Satisfaction,Report this post","I took 5-HTP in a 200 mg dose before bedtime for two days (5-HTP Plus 200mg + Vitamins C & B6). On the second day in the morning I began to have muscular spikes in parts of the body that I had never had, such as the left forearm and even much worse in the four -legs of both legs. These spasms made me difficult to walk well since they were very annoying. I am an athlete, practiced southern and I perform weightlifting regularly. The experience has been very unpleasant."
 9/10/2022 , Burnsy |  Age: 65-74 |   On supplement for less than 1 month |   ," Condition: Other , Overall rating 1.0 ,Effectiveness,Ease of Use,Satisfaction,Report this post","I took this product to help me sleep.  It backfired and energized me.  I sat up in bed like a lightening bolt.  Nine months later, my sleep is impaired from it.  5HTP interacted badly with the serotonin in the anti-depressant I was on.  It should not be sold over the counter.  Drug interactions are problematic.  I hate 5 HTP as it caused so much harm."
 9/3/2022 ,  Age: 35-44 |   On supplement for 1 to less than 2 years |   ," Condition: Other , Overall rating 5.0 ,Effectiveness,Ease of Use,Satisfaction,Report this post","I believe 5HTP should be tried BEFORE antidepressants. I have been on anti-depressants since I was 14. I've attempted suicide 3 times. Last time I was maxed on 2 different kinds. For a year now I have been taking 5HTP and find it to be far more EFFECTIVE. If I forget for a few days I might get down again but I reach out to family and I talk myself down. I could not/would not on anti-depressants. The only side effect I have had is if I take it on an empty stomach. Absolutely feel like this has sa,ved my life!! "
 6/17/2022 , Mary |  Age: 55-64 |   On supplement for less than 1 month |   ," Condition: Other , Overall rating 1.0 ,Effectiveness,Ease of Use,Satisfaction,Report this post",Within 10-15 mins of taking I started getting stomach cramps and very bad nausea. I vomited and had to lie down. Missing out on work time and wish I had read possible side effects first. Never again. 
 5/30/2022 , Local Hippie |  Age: 19-24 |   On supplement for 1 to 6 months |   ," Condition: Other , Overall rating 5.0 ,Effectiveness,Ease of Use,Satisfaction,Report this post",Great hangover cure for psychs 
 5/30/2022 ,      ," Condition: Other , Overall rating 5.0 ,Effectiveness,Ease of Use,Satisfaction,Report this post","My son became angry and moody after losing his dad (he is 39), so he started taking 5-HTP and he calmed down after 3 days of taking this and encouraged me to try it due to the depression which caused anxiety after losing the love of my life of 45 yrs!  Although I grieve and assume I will always (its only been 3 months since he passed) this 5htp had help a lot with the depression, I'm noticing more energy.  "
 5/16/2022 , kitty |  Age: 19-24 |   On supplement for less than 1 month |   ," Condition: Other , Overall rating 4.0 ,Effectiveness,Ease of Use,Satisfaction,Report this post","So I went through years and years of Zoloft, Citalopram, Effexor, Doxepine, and Mirtazapine since I was 16 (I'm nearly 25) All of them had some horrid anxiety side effects, except for the Mirtazapine,but I still didn't feel myself even when taking the Mirt. Anyways, I started looking into natural supplements, and came across the 5 htp. I took the first dose  and IMMEDIATELY felt relief I didn't feel with any of the meds.wow. wow. Wow. I instantly felt motivated. Happy. Wanted to talk !!  My hear,t still palpitated a bit and some stomach discomfort but that's better than feeling hopelessly depressed right? However, I accidentally took 200 mg in the afternoon because I thought each capsule was 50 mg  not 100 mg. In the afternoon I felt like throwing up, rapid breathing, muscle pain, shivers , (serotonin syndrome ?? Maybe?? ) Thankfully I had a secret benzo Stash and could placate the symptoms with a Klonopin. 
But I still won't give up on it. I just think I could have avoided the crisis by reading the instructions and taking a smaller dose to start. I want to feel the relief again when I took the 100mg. Hopefully I can get my hands on a 50 mg. 
Anyways, I'll keep you all updated! "
 5/5/2022 , Cindy Mindy  |  Age: 25-34 |   On supplement for 1 to less than 2 years |   ," Condition: Other , Overall rating 3.0 ,Effectiveness,Ease of Use,Satisfaction,Report this post","Took for anxiety and depression as an alternative to taking prescription medications...it's only been one week. I stopped taking and then the night after I stopped taking kept having lucid dreaming all night, also kept waking up. And wierd lucid dreaming, not totally unpleasant, thankfully, but I could remember every dream I dreamt and I literally woke up and felt like I had not slept because I could remember everything and that was particularly disconcerting. I will be speaking with my dr tmrw., Oh, on a side note, it was the day after I stopped that I had a few glasses of wine so not sure if it was interactions. Also, I would get super drowsy on them when I took during the day, so would only take one at night. I still would like to try just exercise, scheduled sleep and no drinking for awhile to see if that will help with anxiety and depression more than taking supplements. Side effects included headaches all week, as well as nausea if I didn't eat with food. There should be more studies on, I am now too nervous to take more at the moment. "
 5/4/2022 ,  Age: 45-54 |     ," Condition: Other , Overall rating 5.0 ,Effectiveness,Ease of Use,Satisfaction,Report this post",52 yo ... take 100mg at night and my sleep is MUCH deeper. I haven’t slept this good in a long time. Sleep does the body and mind good! Yay! 
 4/27/2022 , PriceyPearl |  Age: 65-74 |   On supplement for less than 1 month |   ," Condition: Other , Overall rating 3.3 ,Effectiveness,Ease of Use,Satisfaction,Report this post","I have only been taking 5-HTP from two shops in UK (Healthspan and Holland & Barrett) for a few weeks, not sure yet whether it helps with sleep problems, my main reason for trying it.  I wonder if the people complaining of side effects such as diarrhoea are reacting to the other supplements added into the tablets/capsules, I note that both these UK brands have added magnesium and B vitamins?"
 4/19/2022 ,  Age: 35-44 |   On supplement for 1 to less than 2 years |   ," Condition: Other , Overall rating 4.7 ,Effectiveness,Ease of Use,Satisfaction,Report this post",When I first started taking 5-HTP 100mg at hs for mild depression I had nausea and stomach pains (great for weight loss) but always a happy mood.  The side effects subsided after a few months of taking it.  Now I take 50mg a day and am so pleased by my positive mood.
 4/14/2022 , Zymood |  Age: 35-44 |   On supplement for less than 1 month |   ," Condition: Other , Overall rating 1.0 ,Effectiveness,Ease of Use,Satisfaction,Report this post","Keeping in mind, when rating my experience its to create awareness of what could happen when you take this with anti-depressants, as I have. My body reacted very harshly and with in an hour of taking the 5-Htp I was violently Ill throwing up, After throwing up and being unable to physically function for a few hours, I was naturally lethargic and left with a hostile headache. Please do not use this while on other medication producing serotonin, its no walk in the park, and just stupid. I learned ,the hard way. "
 4/7/2022 ,  Age: 35-44 |     ," Condition: Other , Overall rating 4.0 ,Effectiveness,Ease of Use,Satisfaction,Report this post","I first tried 5-htp when I found myself feeling down and unable to make myself get up and do my ADL’s my first born had just left for the military and I was having separation anxiety. It was my next oldest son who pointed out to me that I was being snappy and irritated and all that I dis lately was sit  and sleep. This took me by surprise and made me analyze my behavior and do some research ?? I came across the 5-htp, so I purchased some over the counter since it was my first time using it and I, work in the medical field  and we use a progressive introduction to any new drugs or supplements, I took less than the suggested dosage and it worked great, instantly my mood was better, I had more energy though and I read that it is supposed to do the opposite so I am glad that I took a lessor dosage. I only take 1 100mg tab and during the day instead of night as it gives me energy instead of making me sleepy ?? also I am not currently taking any other depression or anxiety medications! I also don’t use it everyday but only once I start to notice a significant drop in my mood that might be triggered by something else"
 2/3/2022 , Romy |  Age: 25-34 |   On supplement for 1 to less than 2 years |   ," Condition: Other , Overall rating 5.0 ,Effectiveness,Ease of Use,Satisfaction,Report this post","I have been using 5HTP for over a year now and it has helped me so much! I use it to treat my overal mood and anxiety. It took about 2 weeks to feel the difference but I feel so much better since. I feel overal less moody and generally happier about small things in life. My interest in socialising has returned and also my creativity. I take 100mg a day(before bed), for over 12 months now and have never experienced any side effects. "
 1/25/2022 , Jak |  Age: 55-64 |   On supplement for less than 1 month |   ," Condition: Other , Overall rating 2.7 ,Effectiveness,Ease of Use,Satisfaction,Report this post",Made me vomit and awful nausea  I am a person who rarely vomits. 
 11/18/2021 , SandyCee |  Age: 45-54 |   On supplement for 6 months to less than 1 year |   ," Condition: Other , Overall rating 5.0 ,Effectiveness,Ease of Use,Satisfaction,Report this post","I have been dealing with depression for most of my life, been on nearly every anti-depressant there is. I had given up. I was severely depressed, angry, rageful, and mean. Decided to give 5 HTP a try, but I was quite skeptical. Within a week I was feeling better than I had felt in years! The darkness had lifted, I wasn't MEAN anymore or driven by anger. I felt like getting out and doing things. I could talk to people without biting their heads off! This stuff really worked for me. Saved my life;, I was very much on the brink."
 11/8/2021 ,      ," Condition: Other , Overall rating 5.0 ,Effectiveness,Ease of Use,Satisfaction,Report this post",It has worked for me.
 11/5/2021 ,      ," Condition: Other , Overall rating 5.0 ,Effectiveness,Ease of Use,Satisfaction,Report this post","Took for about 2 weeks and it did help with anxiety and ability to sleep. Then started to experience some fatigue, muscle spasms in legs and palpitations and irregular heart beat. "
 10/25/2021 ,    On supplement for less than 1 month |   ," Condition: Other , Overall rating 4.0 ,Effectiveness,Ease of Use,Satisfaction,Report this post","I have been taking antidepressants for years to calm my anxiety. I just started taking 5 HTP and it has had a similar positive effect as an antidepressant but much more mild, without the unpleasant side-effects that usually come with an antidepressant. I have felt more calm and clear-headed. I have been having trouble sleeping, not sure if it's related. "
 10/21/2021 , Stuart |  Age: 65-74 |     ," Condition: Other , Overall rating 5.0 ,Effectiveness,Ease of Use,Satisfaction,Report this post",More effective than citalopram for boosting mood.   Didn't do much for me for inducing sleep
 10/18/2021 ,      ," Condition: Other , Overall rating 5.0 ,Effectiveness,Ease of Use,Satisfaction,Report this post",I felt safe with this supplements 
 10/14/2021 ,      ," Condition: Other , Overall rating 5.0 ,Effectiveness,Ease of Use,Satisfaction,Report this post",I will highly recommend this.
 10/11/2021 , #LUVTennis |  Age: 45-54 |   On supplement for 1 to 6 months |   ," Condition: Other , Overall rating 4.3 ,Effectiveness,Ease of Use,Satisfaction,Report this post","Let me first write - there are several different types of 5HTP on the  market...be sure to read the labels carefully.   My original reason for trying 5 HTP (again) was to help me get some zzz's at night - nothing else was working, so I grabbed an older bottle that I purchased from CVS (generic brand).  The first night I took one with my Melatonin and slept better, at least when I woke up at 1 AM - I did go back to sleep.  When the CVS bottle ran dry, I went to the local Vitamin Shoppe and purcha,sed  5HTP, but this one contained Phosporous (the first bottle did not) in addition to 5HTP and B6 - well, let me tell you this one KEPT ME AWAKE all night and I had the feeling of restless leg syndrome.  I ended up taking 1/2 tab of Motrin PM every 2 hours to try and get some sleep.  Talk about being a Zombie for work!  The CVS label said it will produce drowsiness and help with sleep...the Vitamin Shoppe did not.   My takeaway READ the LABEL on each bottle before deciding which one is needed, not all 5 HTP's are equal.  I tried the VS version twice now and same results each time.  I have since gone back to the cheaper version (CVS) and will stick with it.  Good luck to all who are trying to figure out their individual problems...I just want some good quality sleep!   "
 9/8/2021 , Dereck lotsle |  Age: 25-34 |   On supplement for 1 to less than 2 years |   ," Condition: Other , Overall rating 4.3 ,Effectiveness,Ease of Use,Satisfaction,Report this post","I have taken 5-HTP for a while to help with my ADHD. Completely gone! You have to take really small amounts, like 30mg (max) of 5-HTP, then take it with  50mg of venlafaxine, which is an snri. So as the 5htp increases seratonin (in small doses), the venlafaxine prevents some seratonin from reabsorption, allowing seratonin to build up in the brain. Most effective treatment yet!"
 8/19/2021 , Sandy |  Age: 19-24 |   On supplement for less than 1 month |   ," Condition: Other , Overall rating 2.7 ,Effectiveness,Ease of Use,Satisfaction,Report this post","I took these vitamins to help with ADHD. Worst mistake! I have been nauseous to the point where I can’t even drink water without it upsetting my stomach. This is my third time taking them, I wanted to give them a chance and I can’t anymore. I immediately started shaking and sweating after taking them this last time. It felt like I was going to pass out. 5-htp makes your drowsy and does have negative side affects.   Please do research before taking them. Serotonin is good for your body but too mu,ch of it can lead to medical health problems. "
 8/6/2021 , Bran |  Age: 45-54 |   On supplement for 1 to 6 months |   ," Condition: Other , Overall rating 4.3 ,Effectiveness,Ease of Use,Satisfaction,Report this post","The overall effect  for me was a lifted spirit. I was more motivated, also more positive  minded"
 6/14/2021 , Katie |  Age: 25-34 |   On supplement for less than 1 month |   ," Condition: Other , Overall rating 3.7 ,Effectiveness,Ease of Use,Satisfaction,Report this post","I took my first 2 pills last night to help me deal with stressful life events. I have had the side effects of nausea and drowsiness and still feel them 17 hours later. I did feel the serotonin increase as relaxed muscles and that relaxed feeling i have at night just before sleep, but I overslept by 2 hours and still got mildly stressed and burst into tears in a confrontation this morning. Since I am in good health and still find moments of happiness each day, I'm thinking of waiting a dsy or two, and then trying one more pill to see what happens. After reading about side effects and contamination, I'm not sure the risks are worth it for me. I already slept well anyway. "
 5/1/2021 , Blueskies |  Age: 35-44 |   On supplement for 1 to 6 months |   ," Condition: Other , Overall rating 1.0 ,Effectiveness,Ease of Use,Satisfaction,Report this post","Was given 5htp for sleep by my doctor who told me it increases melatonin. Insomnia was causing anxiety & I had a severe adverse reaction for 2 months on it. I should have researched prior as I can't tolerate serotonin increases and my doctor knew my history with ssri's. The worst mental side effects & withdrawals and I continue to experience numbness in body parts and now depression 2 months after. There should be warning labels on these supplements esp since they aren't fda approved. I wish I n,ever touched this garbage."
