dates,details,scores,reviews
 12/21/2014 , StrangeDoc |  Age: 55-64 |   On supplement for 1 to 6 months |   ," Condition: Other , Overall rating 2.7 ,Effectiveness,Ease of Use,Satisfaction,Report this post","I have been taking ""Krill Oil"" off and on now for about 2 months. I have stopped taking it all together now because of a very strange side effect. The side effects I have experienced are gout flare up (feet and ankles) other joints and back pain within 3 to 4 day of taking the Krill oil. My doctor  advised me to stopping it as the effects are not normal."
 12/16/2014 , Allme |  Age: 75 or over |   On supplement for 1 to less than 2 years |   ," Condition: Other , Overall rating 3.7 ,Effectiveness,Ease of Use,Satisfaction,Report this post",
 11/16/2014 ,  Age: 65-74 |   On supplement for 6 months to less than 1 year |   ," Condition: General Health And Wellness , Overall rating 3.0 ,Effectiveness,Ease of Use,Satisfaction,Report this post",
 11/8/2014 , Debra |  Age: 55-64 |   On supplement for 1 to 6 months |   ," Condition: Other , Overall rating 5.0 ,Effectiveness,Ease of Use,Satisfaction,Report this post",Saw a commercial advertising MegaRed Krill oil. Been using about 4 mo. now. My blood pressure is lower than it has ever been and I hope my cholesterol is down when I go back for check up. I really believe this is working for me.
 11/1/2014 ,  Age: 65-74 |   On supplement for 1 to 6 months |   ," Condition: Other , Overall rating 4.3 ,Effectiveness,Ease of Use,Satisfaction,Report this post",Feeling tired nd lethargic .
 8/29/2014 , TRKR |  Age: 25-34 |   On supplement for less than 1 month |   ," Condition: Other , Overall rating 3.0 ,Effectiveness,Ease of Use,Satisfaction,Report this post",i hope krill oil
 8/23/2014 , Gene |  Age: 35-44 |     ," Condition: Other , Overall rating 2.3 ,Effectiveness,Ease of Use,Satisfaction,Report this post",I must be allergic because 15 minutes after I took the first pill I was freezing with chills.  chills lasted about 2 hours. took a few days to feel normal again.  Odd though because I eat shrimp often and have no ill reaction.  
 7/19/2014 ,  Age: 65-74 |   On supplement for 2 to less than 5 years |   ," Condition: General Health And Wellness , Overall rating 4.3 ,Effectiveness,Ease of Use,Satisfaction,Report this post",
 6/15/2014 ,      ," Condition: Other , Overall rating 1.0 ,Effectiveness,Ease of Use,Satisfaction,Report this post",Whole Foods Market does not sell it for a reason. It is not sustainable. 
 5/14/2014 ,  Age: 65-74 |   On supplement for 1 to 6 months |   ," Condition: Other , Overall rating 3.7 ,Effectiveness,Ease of Use,Satisfaction,Report this post","My arthritis was significantly reduced - however, my husband started having heart irregularities and he had to stop taking it."
 5/1/2014 , Damilola |  Age: 13-18 |   On supplement for less than 1 month |   ," Condition:  , Overall rating 1.0 ,Effectiveness,Ease of Use,Satisfaction,Report this post",My sister died
 4/30/2014 , Disissy |  Age: 55-64 |   On supplement for 1 to 6 months |   ," Condition: Other , Overall rating 5.0 ,Effectiveness,Ease of Use,Satisfaction,Report this post",I don't feel so stiff in the morn.
 4/24/2014 ,      ," Condition: Other , Overall rating 5.0 ,Effectiveness,Ease of Use,Satisfaction,Report this post",
 4/21/2014 , J. |  Age: 55-64 |   On supplement for less than 1 month |   ," Condition: Other , Overall rating 4.0 ,Effectiveness,Ease of Use,Satisfaction,Report this post",Lipid panel in normal range but having allergic reaction with hive like rash all over the body and having what feels like light electric charges in legs. Time to quit.
 4/20/2014 ,  Age: 45-54 |     ," Condition: Other , Overall rating 5.0 ,Effectiveness,Ease of Use,Satisfaction,Report this post",I started taking Krill Oil for hot flashes and night sweats due to menopause. After two weeks it was very effective.
 4/13/2014 , Suzie |  Age: 55-64 |   On supplement for 1 to 6 months |   ," Condition: Other , Overall rating 3.0 ,Effectiveness,Ease of Use,Satisfaction,Report this post",Worked well for cholesterol-went down 20% in two months of 2500 IU per day.  What I did not expect was to wake up with severe pain and stiffness in all my joints after taking it for two months I am stopping as this is not normal.  I am finding others with the same experience of Krill and then new joint pain!!
 3/26/2014 , Chris |  Age: 55-64 |   On supplement for less than 1 month |   ," Condition: Other , Overall rating 5.0 ,Effectiveness,Ease of Use,Satisfaction,Report this post","iHave arthritis in my knees,and taking pain killers every day,within 4days of using king krill I no longer need pain killers,I am amazed,wish I knew about it sooner."
 3/21/2014 , crissy |  Age: 55-64 |   On supplement for less than 1 month |   ," Condition:  , Overall rating 5.0 ,Effectiveness,Ease of Use,Satisfaction,Report this post","I have been taking 1500mg of Krill oil for just over a week, I have previously had severe swelling in my hand,ankles and knees, for the last 2 days i can walk so much better , I am finally getting to see my knee caps , the swelling in my hands is virtually non existent,and only after 1 week, i look forward to more results. I just can't believe it works so well, I'm sold on it now, Healthy Care Krill Oil Higher Strength.I just can't believe how good it is. 1500gm"
 3/20/2014 , Smokin |  Age: 25-34 |   On supplement for less than 1 month |   ," Condition: Other , Overall rating 2.7 ,Effectiveness,Ease of Use,Satisfaction,Report this post","in my experience after 6 days, I have constipation!!  The pills are two big. Butt cheeks are numb after a nights sleep?   "
 3/16/2014 , Bklyn walker |  Age: 55-64 |   On supplement for less than 1 month |   ," Condition: Other , Overall rating 5.0 ,Effectiveness,Ease of Use,Satisfaction,Report this post","Suffering with hip bursitis and inflamed Achillies tendon for several years, limping around, putting my left sock on so difficult. Been on Krill oil and evening primrose supplement for about 2 1/2 weeks and the difference is remarkable. Pain is reduced by about75 percent, range of motion increased substantially. I am amazed and will continue taking it, hopefully after a few months Inflammation will disappear. This is the first thing of many things I have tried that actually helped.  I use Mercol,a. Wow!"
 3/11/2014 ,      ," Condition: Other , Overall rating 1.0 ,Effectiveness,Ease of Use,Satisfaction,Report this post",I have an allergy to shellfish and stupidly didn't make the association with krill oil supplements.  It was only a few days after taking them when I was really very ill that I made the connection.  So my strong advice is that if you have an allergy to shellfish don't touch krill oil supplements. 
 3/3/2014 , don mark |  Age: 75 or over |   On supplement for less than 1 month |   ," Condition:  , Overall rating 3.0 ,Effectiveness,Ease of Use,Satisfaction,Report this post","after taking krill oil plus 500 mg for 2 weeks red spots appeared around my neck and front of my chest. Is it possible I have and allergy to this product. I also take 20 mgs rabeprazole,sandoz telmisartan80/12 mg apo rosuvastatin 10 mg. meloxicam 15mg along with centrum for over 50ys. would any of these counteract with krill?"
 2/14/2014 , stardust |  Age: 55-64 |   On supplement for 1 to 6 months |   ," Condition: Other , Overall rating 5.0 ,Effectiveness,Ease of Use,Satisfaction,Report this post",After 2 months of taking Krill Oil along with my usual 20 mg of Crestor ( which IVe taken alone for over 2 years never reducing levels below 215 ) I'm happy to report my last test came in at 155
 1/28/2014 , toptoes |  Age: 75 or over |   On supplement for less than 1 month |   ," Condition: Other , Overall rating 1.0 ,Effectiveness,Ease of Use,Satisfaction,Report this post",I have only taken 2 tablets and will not be taking any  more. I took one after breakfast on day one and got bad indigestion same on day two.I think there should be a warning that this might happen.
 1/26/2014 , Willow |  Age: 45-54 |   On supplement for 1 to 6 months |   ," Condition: Other , Overall rating 2.7 ,Effectiveness,Ease of Use,Satisfaction,Report this post","I am only into my third month, so I don't feel I can say if there has been any noticeable changes I decided to give them a try as I've just started the menopause, have arthritis/ cramps/ circulation problems,although I'm not overweight I have gained two stones in the last four years as my exercise level as declined due to painful joints and pms problems.i also  have depression. I will finish my third month of supplements and review my situation again then."
 1/26/2014 ,  Age: 75 or over |   On supplement for 6 months to less than 1 year |   ," Condition: Other , Overall rating 5.0 ,Effectiveness,Ease of Use,Satisfaction,Report this post",HAPPY TO SAY CHOLESTEROL DECREASED 30 POINTS IN THREE MONTHS
 1/24/2014 ,  Age: 55-64 |   On supplement for 2 to less than 5 years |   ," Condition: Other , Overall rating 5.0 ,Effectiveness,Ease of Use,Satisfaction,Report this post",In 2 years CHO went from over 250 to 180.
 1/12/2014 , Daisyday |  Age: 45-54 |   On supplement for less than 1 month |   ," Condition: Other , Overall rating 5.0 ,Effectiveness,Ease of Use,Satisfaction,Report this post","I was diagnosed  with arthritis and so called fibromyalgia. Had constant pain throughout my body.  I tried Omega products, but only to find a terrible aftertaste.  I heard of Super Krill so I thought I would try it.  I feel great.  My pain has subsided considerably and no aftertaste.  I would highly recommend this product for anyone dealing with joint or muscle pain."
 1/10/2014 , vaag |  Age: 65-74 |   On supplement for 5 to less than 10 years |   ," Condition: Other , Overall rating 3.7 ,Effectiveness,Ease of Use,Satisfaction,Report this post",Much like fish oil but mostly from the antarctic waters. Cleaner water I hope.
 1/9/2014 , ERNESTO |  Age: 45-54 |   On supplement for less than 1 month |   ," Condition: Other , Overall rating 4.0 ,Effectiveness,Ease of Use,Satisfaction,Report this post",Less pain in hip joint 
 12/27/2013 ,  Age: 45-54 |     ," Condition: Other , Overall rating 4.0 ,Effectiveness,Ease of Use,Satisfaction,Report this post","I had osteoarthritic and rheumatoid pain in stiffness in my joints for years and recently had to start regular paracetamol and ibuprofin. Prednisolone was the only medication that had ever had any effect previously. The krill oil and fish oil supplement taken with evening primrose oil had an immediate effect , waking with noticeably less pain and stiffness."
 11/13/2013 , louie |  Age: 45-54 |   On supplement for 2 to less than 5 years |   ," Condition: Rheumatoid arthritis (RA) , Overall rating 4.0 ,Effectiveness,Ease of Use,Satisfaction,Report this post",I was taking 12 fish oil but now take one krill oil capsule and it easier for me to absorb.
 11/5/2013 ,      ," Condition: Other , Overall rating 4.3 ,Effectiveness,Ease of Use,Satisfaction,Report this post",
 10/27/2013 , Norm |  Age: 45-54 |   On supplement for 1 to 6 months |   ," Condition: Other , Overall rating 5.0 ,Effectiveness,Ease of Use,Satisfaction,Report this post",Just the smell and taste isn't good esp if they leek as they do some times 
 10/24/2013 , sperrinone |  Age: 55-64 |   On supplement for 1 to 6 months |   ," Condition: Other , Overall rating 2.3 ,Effectiveness,Ease of Use,Satisfaction,Report this post",I have taken Omega Super Krill for 1 month.  The last few days I've developed isolated skin rashes with pustules.  I'm suspecting that this may be the cause so will discontinue and pray that these itchy rashes subside.  The Krill is the fishiest smell when opening the bottle.  I have to hold my breath!!  
 10/4/2013 , all fixed up |  Age: 65-74 |   On supplement for 1 to less than 2 years |   ," Condition: Other , Overall rating 5.0 ,Effectiveness,Ease of Use,Satisfaction,Report this post",I have been diagnosed with intermittent claudication and have had 2 stents in my right leg but I still had minor discomfort in my r/leg after my 2 mile walks since I've been taking my krill oil I have found improvement
 9/7/2013 , maggie |    On supplement for 1 to 6 months |   ," Condition: Other , Overall rating 5.0 ,Effectiveness,Ease of Use,Satisfaction,Report this post",Krill o il has help me so much with my pinch nerve and my.hip
 8/25/2013 ,  Age: 45-54 |   On supplement for 1 to 6 months |   ," Condition: Other , Overall rating 5.0 ,Effectiveness,Ease of Use,Satisfaction,Report this post",
 8/12/2013 , rob |  Age: 55-64 |   On supplement for 1 to less than 2 years |   ," Condition: General Health And Wellness , Overall rating 4.3 ,Effectiveness,Ease of Use,Satisfaction,Report this post",
 8/8/2013 ,      ," Condition: Other , Overall rating 3.0 ,Effectiveness,Ease of Use,Satisfaction,Report this post",
 6/24/2013 ,  Age: 55-64 |   On supplement for 1 to 6 months |   ," Condition: Other , Overall rating 5.0 ,Effectiveness,Ease of Use,Satisfaction,Report this post","Not only has most of my arthritis gone, but my hip bursitis completely gone and the swelling that was on my hip bone too! The bumps on my pointer fingers too. Remember to take only high quality krill oil with the right amount of astaxanthin and DHA and EPA. I use Dr. Mercola's, but NKO is supposed to be excellent too. And I take 2.5 grams a day. (5-500 mg per day spaced out during the day) I have so much energy and my blood pressure is the lowest it's ever been! Will be checking cholesterol in A,ugust. Read all you can on Krill oil capsules. You will be pleasantly surprised. It's changed my life.  "
 6/18/2013 , clj065 |  Age: 45-54 |   On supplement for 2 to less than 5 years |   ," Condition: Other , Overall rating 5.0 ,Effectiveness,Ease of Use,Satisfaction,Report this post","I take 1000 mg NOW Krill Oil each day (for 3 years now) after Dr. tried me on a few different cholesterol meds, which made me feel so weak. Krill Oil has kept my cholesterol in the healthy range all these years and I plan to take it the rest of my life. No side effects at all. Very happy with the results."
 6/13/2013 ,  Age: 45-54 |   On supplement for 1 to 6 months |   ," Condition: Other , Overall rating 2.3 ,Effectiveness,Ease of Use,Satisfaction,Report this post","I am a 53-year-old female. Krill oil made my arthritis in my hands feel better than it ever has - too bad it's made me so sick. In my fifth week of treatment, getting steadily more sick, day by day, with extreme gastrointestinal problems, I finally noticed that all of my symptoms had started with the Krill. I am on my 3rd day off and am finding that the symptoms are still lingering. I was very hopeful about this product but, after what I've been through for five weeks, I do not recommend it."
 6/8/2013 ,  Age: 45-54 |   On supplement for 1 to 6 months |   ," Condition: Other , Overall rating 3.0 ,Effectiveness,Ease of Use,Satisfaction,Report this post",
 5/26/2013 ,  Age: 55-64 |   On supplement for 1 to 6 months |   ," Condition: Other , Overall rating 5.0 ,Effectiveness,Ease of Use,Satisfaction,Report this post",Had a knee injury playing football 35 years ago and now arthritis and swelling developed. Been taking Krill oil and fish oil in 2500 mg daily and swelling and pain subsided.
 5/12/2013 , Don |  Age: 65-74 |   On supplement for less than 1 month |   ," Condition: Other , Overall rating 4.7 ,Effectiveness,Ease of Use,Satisfaction,Report this post","Schiff MegaRed Joint Care.  I took just one pill and my knee arthritis disappeared and my hand stiffening also went away.  After taking 3 capsules, I stopped because I got tired.  I found that I can take one capsule every three days and it works.  Because this is a blend product and not pure Krill Oil, I will next find a pure product and see if that component is the cure and not the blend."
 5/8/2013 , daisy0808 |  Age: 55-64 |   On supplement for 1 to 6 months |   ," Condition: Other , Overall rating 4.3 ,Effectiveness,Ease of Use,Satisfaction,Report this post","I have been taking this for about 1 month, the last few days I have been feeling itchy, no rash that I can see but itchy all over my body, anyone else having this issue. I hope it is not the kril, because I really like what it is doing for me."
 5/5/2013 , Louise |  Age: 65-74 |   On supplement for 6 months to less than 1 year |   ," Condition: Other , Overall rating 4.7 ,Effectiveness,Ease of Use,Satisfaction,Report this post","I have arthritis in two finger joints. They were very swollen and the pain was excruciating. After taking krill oil (one capsule a day) for 6 months, the swelling has subsided and so has the pain. They only hurt now if I overuse them or bump them. It took about 3 months for it to really start working.~ I am pleased with the results as I do not like to take pain meds. I used Clark's Nutrition Antartic Krill Oil"
 4/1/2013 , Too young.  |  Age: 25-34 |     ," Condition: Other , Overall rating 2.3 ,Effectiveness,Ease of Use,Satisfaction,Report this post",I have high cholesterol and after getting a rash on Lipitor I switched to krill oil. I got the rash again. It is an awful itchy hive. 
 3/27/2013 , benny |  Age: 55-64 |   On supplement for 6 months to less than 1 year |   ," Condition: Other , Overall rating 3.0 ,Effectiveness,Ease of Use,Satisfaction,Report this post",
 3/23/2013 , Patty |  Age: 55-64 |   On supplement for 1 to less than 2 years |   ," Condition: Other , Overall rating 5.0 ,Effectiveness,Ease of Use,Satisfaction,Report this post",Has assisted with the reduction of good an bad cholesterol levels
 2/26/2013 , spring girl  |  Age: 45-54 |   On supplement for 1 to 6 months |   ," Condition: Other , Overall rating 5.0 ,Effectiveness,Ease of Use,Satisfaction,Report this post","My feet hurt.. A lot!  Maybe it's the beginnings of osteoarthritis (I'm 51 years young) but I have to fight this because one has to walk!  Last week, after having run out of my Superkrill for a few weeks, I went to the dr to get a referral to a foot specialist, someone who would treat me as a patient, not a customer as I've been down that road, because the pain is increasing.  I then scored some SuperKrill and two days later my pain is gone. Unbelievable! I've got an appointment in two months be,cause they called me but In the meantime I think I'm okay.  I feel like the tin man and the krill oil lubes me up from the inside!"
 2/20/2013 , sandy tt |  Age: 45-54 |   On supplement for less than 1 month |   ," Condition: Rheumatoid arthritis (RA) , Overall rating 4.7 ,Effectiveness,Ease of Use,Satisfaction,Report this post","Hi guys after trying various remedies available on the market, a friend of mine suggested I try Krill Oil, so I figured what have I got to lose, the pain is unbearable at times and frustrating to say the least! Anyway I decided to give it a shot and have been taking a capsule every day for the last 3 days and I swear to you the results have been amazing! So anyone out there whose been diagnosed with eith RA or OA give it a try!!! althoug as said it may be expensive but well worth it! and Good Lu,ck!"
 2/15/2013 , Dommon |  Age: 75 or over |   On supplement for 1 to 6 months |   ," Condition: Other , Overall rating 5.0 ,Effectiveness,Ease of Use,Satisfaction,Report this post",my blood pressure was slightly high after taking krill oil capsules (750mg.) for three months my pressure has dropped to normal ! I am eighty six years of age kia ora Dommon.
 1/8/2013 , Becky |  Age: 45-54 |   On supplement for 1 to 6 months |   ," Condition: Other , Overall rating 4.0 ,Effectiveness,Ease of Use,Satisfaction,Report this post",Cholesterol levels have dropped from 220 range to 195 after 2 months use with no change in diet or exercise.  Will continue  with krill oil supplement to see if there is any relief from joint pain and stiffness with ongoing use. 
 1/3/2013 , Sciatic Nerve Pain |  Age: 45-54 |   On supplement for less than 1 month |   ," Condition: Rheumatoid arthritis (RA) , Overall rating 5.0 ,Effectiveness,Ease of Use,Satisfaction,Report this post",I started taking Mega Red krill oil 2 wks ago because my husband has heart disease in the family & I'm 45 female. I noticed my joints&tendinitis don't hurt finally. I have more energy and migraines are down. 
 11/9/2012 , Healthy Heart |  Age: 45-54 |   On supplement for 1 to 6 months |   ," Condition: Other , Overall rating 5.0 ,Effectiveness,Ease of Use,Satisfaction,Report this post",I been taking 2g of Neptune NOW Krill Oil once a day for three months due to high Cholostrol. i haven't retested yet. I will post result after testing.
 10/24/2012 , kat |  Age: 55-64 |   On supplement for 1 to less than 2 years |   ," Condition: Other , Overall rating 5.0 ,Effectiveness,Ease of Use,Satisfaction,Report this post",Mega red as reduced my HDL any my blood pessure..Although I went to the Dr.today..had some test done a week ago..now he is saying I have fat in my Liver..but I don't believe it has anything to do with the Krill oil....
 10/20/2012 , Dancer |  Age: 55-64 |   On supplement for less than 1 month |   ," Condition: Other , Overall rating 5.0 ,Effectiveness,Ease of Use,Satisfaction,Report this post","I have arthritis in my hands, very painful. My baby finger on my right hand had been swollen and exceptionally painful for moths. It would keep me awake at night. Within a few hours of taking krill oil my baby finger was about half the size and my pain level was also about half. I have tried so many natural health remedies and none has helped me. I was truly amazed at the speed at which krill oil has worked for me, given my arthritis is quite bad in my hands and was getting worse. My baby finger, was the worst, it was so swollen. Also I noticed I am calmer in general and as I am taking nothing else new, I attribute this calmness also to the krill oil. I have had no side effects. "
 10/9/2012 ,  Age: 55-64 |   On supplement for 1 to less than 2 years |   ," Condition: Other , Overall rating 3.3 ,Effectiveness,Ease of Use,Satisfaction,Report this post","it helps, not cures."
 10/5/2012 ,  Age: 45-54 |   On supplement for 1 to less than 2 years |   ," Condition: General Health And Wellness , Overall rating 5.0 ,Effectiveness,Ease of Use,Satisfaction,Report this post",
 9/5/2012 , rhodygirl |  Age: 25-34 |   On supplement for less than 1 month |   ," Condition: Premenstrual syndrome (PMS) , Overall rating 2.7 ,Effectiveness,Ease of Use,Satisfaction,Report this post","The krill oil (NKO) NOW Neptune Krill Oil (500mg) made me jittery, uneasy and on edge. I had major agitation and its not worth it. It took me a minute to realize it was the krill oil the dosage is to high (1000mg). I am going to attempt to take these in maybe 100mg."
 9/4/2012 , Sapodilla |  Age: 45-54 |   On supplement for less than 1 month |   ," Condition: Other , Overall rating 4.3 ,Effectiveness,Ease of Use,Satisfaction,Report this post","I bought this product for my mother who was diagnosed with progressive supranuclear palsy. Mom has been immobile for about 6 months, and could not get up by herself, sit up without even falling, and unable to use the walker. After taking a krill oil product for 3 days, she began getting up and walking around the house all by herself. Her speech has also improved, and she is in a positive mood. I am totallly surprised at her progress in just two weeks. I have been telling everyone about krill oil,. I do not know if it is the brand or simply krill oil, but I am pleased at the results."
 8/16/2012 , Swisse |  Age: 65-74 |   On supplement for less than 1 month |   ," Condition: Other , Overall rating 5.0 ,Effectiveness,Ease of Use,Satisfaction,Report this post","I started taking Krill oil because I have a lot of knee pain, I had been taking fish oil but I was taking to many and they are huge, I bought a bottle of Swisse red krill oil when it was on special I have only been taking it for 3 weeks and I can't believe the difference, I can walk up and down stairs and hardly have any pain. I am so happy and I hope the pain has gone for good."
 8/8/2012 , Can walk |  Age: 45-54 |   On supplement for less than 1 month |   ," Condition: Other , Overall rating 5.0 ,Effectiveness,Ease of Use,Satisfaction,Report this post",Within a week a was not lomping anymore or in pain
 7/25/2012 ,  Age: 45-54 |   On supplement for 1 to 6 months |   ," Condition: Other , Overall rating 2.0 ,Effectiveness,Ease of Use,Satisfaction,Report this post","Hi There I started taking Krill Oil caps and within 3 days came out in a red itchy rash around my abdo area that ended up all over my body. I experienced a lot of itching on my feet,legs and pubic area and my abdomen was very red,hot and sore. I am happy for the people that have had great results taking Krill and share dissapointment with others that like myself may just have to accept that we are allergic or reactive to Krill and may need to stop taking it."
 7/20/2012 , Hyacynth |  Age: 55-64 |   On supplement for 1 to 6 months |   ," Condition: Other , Overall rating 5.0 ,Effectiveness,Ease of Use,Satisfaction,Report this post","I have been able to reduce my hydrocodone pain therapy.  I cannot take NASIDS because of ulcers.  I take the hydrocodone for pain; it also seems to help with my arthtitis pain.  Also, I notice that my skin does not feel dry and fine line on my face seem to be disappearing."
 6/18/2012 , natrol |  Age: 19-24 |   On supplement for less than 1 month |   ," Condition: Other , Overall rating 4.3 ,Effectiveness,Ease of Use,Satisfaction,Report this post",I just star to used
